,code,product_name
11208,18523,mlekovita ser kasztelański kg 
11209,18524,mlekovita ser gouda szlachetna kg 
11210,18525,mlekovita ser białostocki kg 
11211,18526,koral lody ekipa sorbet cytrynowy ml 
11212,18528,sokołów szynka z prodiża kg 
11213,18529,kozłowski rolada boczkowa kg 
11214,18535,piekuś kostka dakłas kg 
11215,18536,marcepan ciasto agrestowa chmurka kg 
11216,18537,marcepan ciasto smak alzacji kg 
11217,18538,mazury polędwica sopocka kg 
11218,18539,marcepan placek drożdzowy szt 
11219,18540,marcepan ciasto pszczółka kg 
11220,18541,marcepan kokosowy raj kg 
11221,18542,marcepan ciasto chrupiąca fantazja kg 
11222,18543,marcepan ciastka owsiane kg 
11223,18544,marcepan ciastka czeko cookis kg 
11224,18545,u renaty pierogi z jagodami kg 
11225,18546,rogowo kiełbasa śląska kg 
11226,18547,rogowo kiełbasa grillowa kg 
11227,18549,rogowo kiełbasa grillowa z serem kg 
11228,18550,marcepan ciasto piknikowe z metra kg 
11229,18551,marcepan ciasto czeko wiśnia kokos z metra kg 
11230,18552,olsza ciasto brulle z owocami kg 
11231,18553,olsza pijana wiśnia kg 
11232,18554,madej wróbel kiełbasa drobiowa ze szpinakiem i serem kg 
11233,18555,hert pieczywo pszenne z siemieniem lnianym g 
11234,18557,jbb krafterki kiełbaski podsuszane kg 
11235,18558,chrupek jagodzianka szt 
11236,18559,rogowo kiełbasa ze słoika kg 
11237,18560,marcepan kostka królewska kg 
11238,18561,marcepan ciastka chia kg 
11239,18562,marcepan ciastka orkiszowe kg 
11240,18563,wędliniarz kiełbasa polska kg 
11241,18564,wędliniarz wędzonka z pieprzem kg 
11242,18567,koczorowscy bułka fitnes szt 
11243,18568,la lorraine chleb żytnio pszenny ze słonecznikiem g 
11244,18569,miłosław amerykanka szt 
11245,18570,kilian ernik słony karmel porcjowany szt 
11246,18571,kilian tarta z owocami szt 
11247,18572,kraina ciast pijak kg 
11248,18573,kraina ciast jogurtowe z owocami kg 
11249,18574,kraina ciast żelowo truskawkowe kg 
11250,18575,hermar kiełbasa z fileta kg 
11251,18576,madej wróbel kiełbasa kanapkowa z indyka kg 
11252,18577,olek pączek szt 
11253,18578,nozdryn płotniccy bułka wrocławska długa g 
11254,18579,nozdryn płotniccy bułka grachamka g 
11255,18580,nozdryn płotniccy bułka dyniowa g 
11256,18583,nozdryn płotniccy chałka g 
11257,18587,nozdryn płotniccy bułka kajzerka g 
11258,18590,nozdryn płotniccy trojak maślany g 
11259,18591,marcepan ciasto cytrynowe orzeżwienie kg 
11260,18592,hert jagodzianka szt 
11261,18593,hert bajaderka szt 
11262,18594,hert babka foremka różne smaki kg 
11263,18595,hert sernik na zimno kg 
11264,18596,hert fale dunaju kg 
11265,18597,duda kiełbasa podwawelska kg 
11266,18598,anna placek drożdżowy kg 
11267,18599,exclusive cookies rożki z jagodą kg 
11268,18600,polfood gapki kg 
11269,18602,pomidor paprykowy kg 
11270,18603,rogalik bezy g 
11271,18604,sokołów kurczak kanapkowy z filetem kg 
11272,18607,olsza metrowiec wiosenny kg 
11273,18608,marcepan piaskowiec z metra kg 
11274,18609,marcepan babka jogurtowa kg 
11275,18611,sokołów pasztetowa wędzona kg 
11276,18612,biegun szynka wieprzowa w galarecie kg 
11277,18613,wędliny od zawsze parówki hot dog kg 
11278,18614,słomiński szynka konserwowa kg 
11279,18615,wędliny od zawsze kiełbasa toruńska kg 
11280,18616,kozłowski boczek szefa z czosnkiem kg 
11281,18617,peklimar pieczeń ze śliwką kg 
11282,18618,wędliny od zawsze piecuch kg 
11283,18620,mrotek karczek pieczony kg 
11284,18622,mrotek pasztet z dziczyzny kg 
11285,18623,allora oliwki zielone nadziewane migdałem kg 
11286,18624,allora papryczki czerwone z serkiem kg 
11287,18625,swojscy szynka wojskowa kg 
11288,18626,allora oliwki z serem kg 
11289,18627,piekuś beza pavlova g 
11290,18628,allora papryka czerwona dzwonki z serkiem kg 
11291,18629,artvision pączek szt 
11292,18630,skrzypiec chleb pyszny g 
11293,18631,swojscy kiełbasa podlaska kg 
11294,18632,szypiórkowski ciasto kg 
11295,18633,marcepan ciasto mozaika kg 
11296,18634,miłosław wiecznik szt 
11297,18635,ozimek konserwa turystyczna g 
11298,18636,ozimek kiełbasa pieczona z indyka kg 
11299,18638,kraina ciast śmietankowo toffi kg 
11300,18639,ozimek kiełbasa budżetowa kg 
11301,18641,la petite kostka słoneczna kg 
11302,18661,krzeszyc karolinki z szynki kg 
11303,18664,frątczak kiełbasa regionalna kg 
11304,18665,marcepan ciasto puszek z metra kg 
11305,18666,wędliny od zawsze kabanosy bez dod e kg 
11306,18675,miłosław ekler szt 
11307,18676,anna ciasteczka orkiszowe kg 
11308,18679,viola kiełbaski belgijskie kg 
11309,18680,szypiórkowski ciasteczka kruche kg 
11310,18681,kilian babeczka z serem szt 
11311,18684,łukosz filet maślany z indyka kg 
11312,18685,maratońska ciasto cappucino kg 
11313,18686,koma kiełbasa wędzona suszona kg 
11314,18687,marcepan ciasto mango kg 
11315,18692,tosta mini kwadraciki kg 
11316,18693,sława kiełbasa sławska z indyka kg 
11317,18694,wędliny od zawsze staropolanki kg 
11318,18695,jbb mielonka extra z łysych kg 
11319,18697,witnica kiełbasa chłopska kg 
11320,18698,dworecki schab z wędzarni kg 
11321,18699,różyccy kiełbasa schabowa kg 
11322,18700,jagódka okrągłe ciasto jogurtowe z porzeczką szt 
11323,18701,indykpol pierś wędzona kg 
11324,18702,haga kiełbasa śląska kg 
11325,18705,pamso kraina smaków blok szynkowy kg 
11326,18707,różyccy kiełbasa rzeszowska kg 
11327,18708,wesoła rodzinka kiełbasa z szarpaka narobi ci smaka kg 
11328,18710,madej wróbel szynka wyśmienita kg 
11329,18711,prosiaczek schab gospodarski wędzony kg 
11330,18712,sójka chleb blachowy g 
11331,18714,mrotek dzik schab wędzony kg 
11332,18716,mrotek kiełbasa krakowska sucha kg 
11333,18717,mrotek kiełbasa piwna kg 
11334,18718,mrotek paróweczki kg 
11335,18719,mrotek serdelki kg 
11336,18720,mrotek kiełbasa polska pieczona kg 
11337,18721,mrotek frankfurterki kg 
11338,18723,witnica smalec wieprzowy topiony kg 
11339,18726,kargowa chleb stefana g 
11340,18728,spomlek lublanka twaróg półtłusty krajanka kg 
11341,18729,miłosław paróweczki z szynki kg 
11342,18730,słomiński udziec pieczony z indyka kg 
11343,18733,olsza beza szt 
11344,18734,staropolskie wędliny kiełbaski śląskie kg 
11345,18735,staropolskie wędliny schab z liściem kg 
11346,18736,piekuś pasztecik z kapustą i grzybami g 
11347,18738,olewnik kiełbasa krakowska z fileta z kurczaka kg 
11348,18740,zielona kraina naleśniki z serem i rodzynkami kg 
11349,18742,bukat salceson firmowy kg 
11350,18743,mat piek ciabata szt 
11351,18745,witnica kiełbasa kaszubska z czosnkiem kg 
11352,18746,la petite ciastka koperty kg 
11353,18747,trewala wędzony kg 
11354,18749,jbb kiełbasa piwna kg 
11355,18750,la lorraine francuzy z owocem szt 
11356,18752,kilian babeczka charlotte szt 
11357,18754,miłosław przysmak garmażeryjny kg 
11358,18755,miłosław paróweczki śląskie kg 
11359,18756,piotruś chleb rodzinny krojony g 
11360,18757,laskowski besamemucho kg 
11361,18758,laskowski czarny sad kg 
11362,18759,laskowski kostka kokosowa kg 
11363,18760,laskowski ptasie mleczko cytryna kg 
11364,18761,wędliny od zawsze rogal z szynki kg 
11365,18762,wędliny od zawsze schab z liściem kg 
11366,18763,olewnik kiełbasa myśliwska z szynki do lady kg 
11367,18764,wędliny od zawsze pieczeń rzymska kg 
11368,18765,mark s kiełbasa krucha pieczona kg 
11369,18766,wesoła rodzinka gotowany kurczak rozpływa się w ustach kg 
11370,18767,wędliny od zawsze kiełbaski śląskie kg 
11371,18768,swojski stragan kiełbasa parówkowa królewska kg 
11372,18769,śrem łowicki kg 
11373,18770,kilian kostka loara kg 
11374,18771,kilian kostka pigalle kg 
11375,18772,kilian król williams szt 
11376,18773,kilian marsylianka szt 
11377,18774,kosów lacki ser typu szwajcarskiego kg 
11378,18775,mik mar ciastka delicje kg 
11379,18776,mik mar ciasta muszelki kg 
11380,18777,sokołów kiełbasa złota jesień kg 
11381,18778,kilian napoleonka kg 
11382,18779,kurki g 
11383,18781,kilian kostka mistral kg 
11384,18782,kaczmarczyk miód faceliowy kg 
11385,18783,kaczmarczyk miód lipowy kg 
11386,18784,kaczmarczyk miód słonecznikowy kg 
11387,18785,kaczmarczyk miód gryczany kg 
11388,18786,kaczmarczyk miód faceliowy g 
11389,18787,kaczmarczyk miód lipowy g 
11390,18788,kaczmarczyk miód słonecznikowy g 
11391,18789,kaczmarczyk miód gryczany g 
11392,18790,kaczmarczyk miód wrzosowy g 
11393,18791,kaczmarczyk pierzga pszczela g 
11394,18792,kaczmarczyk miód akacja g 
11395,18793,kaczmarczyk miód akacja ml 
11396,18794,kaczmarczyk miód akacja ml 
11397,18795,la lorraine pizzerina pepperoni g 
11398,18796,la lorraine bajgiel cebula czosnek ziarna g 
11399,18798,skrzypiec rogal marciński kg 
11400,18799,laskowski kostka na galaretce truskawki kg 
11401,18800,bell szynka królewska gotowana kg 
11402,18802,wędliny od zawsze smaczek konserwowy kg 
11403,18804,cf snack szpinakowy z serem typu greckiego g 
11404,18805,cf snack leczo g 
11405,18806,michowianka twaróg półtł kulka kg 
11406,18809,bielesz ogonówka wiejska kg 
11407,18810,ozimek kiełbasa codzienna kg 
11408,18811,niewieścin udko w galarecie kg 
11409,18812,chabura pieczeń z polędwiczką kg 
11410,18814,karol kiełbasa żywiecka kg 
11411,18815,papryczka chilli szt 
11412,18816,trojanka eklerki toffi kg 
11413,18817,urbańscy wafle domowe kajmak kg 
11414,18818,amir ciastka przysmak rycki luz kg 
11415,18819,bell salami prowansalskie kg 
11416,18820,swojscy szynka z piersi kurczaka kg 
11417,18821,grobelski chleb witalny g 
11418,18823,ita rogale marcińskie kg 
11419,18824,tuliszków żurek ml 
11420,18825,laskowski kostka pijana beza kg 
11421,18826,swojski stragan szynka z tłuszczykiem kg 
11422,18828,swojski stragan szynka z majerankiem kg 
11423,18829,sierpc ser salami królewski kg 
11424,18831,kajmak ciastka bezy kg 
11425,18832,cf ciastko wieloziarnista ser truskawka szt 
11426,18834,sokołów golonka w galarecie kg 
11427,18835,johny bee opłatek ufo 
11428,18836,wawrzyniak batony fitnes kg 
11429,18839,marcepan kostka yuzu kg 
11430,18840,słomiński ogonówka dojrzewająca kg 
11431,18854,drozd schab polski kg 
11432,18855,drozd krakowska parzona kg 
11433,18856,drozd szynka z kotła kg 
11434,18857,drozd kiełbasa piwna kg 
11435,18858,drozd szynka w siatce kg 
11436,18859,kozłowski pieczeń wieprzowa kg 
11437,18860,grobelski kostka porzeczkowa kg 
11438,18862,ciepłuch wędzonka krotoszyńska kg 
11439,18863,jagódka sernik ze śliwkami kg 
11440,18864,kilian twarożki kg 
11441,18866,dworecki kiełbasa krakowska parzona luz 
11442,18867,dworecki kiełbasa śniadaniowa kg 
11443,18868,la lorraine zapiekanka wegetariańska g 
11444,18869,laskowski kostka murzynek kg 
11445,18870,laskowski karmelowe jabłko prażone kg 
11446,18872,gustavus kiełbasa piwna kg 
11447,18873,goodvalley kiełbasa codzienna kg 
11448,18874,bogdaniec kule serowe kg 
11449,18875,piekuś czekoladowe języczki kg 
11450,18876,piekuś adwokatki kg 
11451,18877,różyccy kiełbasa dziecięca kg 
11452,18878,olsza canneloni mix szt 
11453,18879,drozd schab hetmański kg 
11454,18880,solar koreczki śledziowe bryza kg 
11455,18881,solar filet śledziowy a la łosoś z papryką jalapeno kg 
11456,18882,bielesz szynka wiśniowa kg 
11457,18883,mrotek schab pieczony kg 
11458,18884,kabanos kiełbasa toruńska regionalna kg 
11459,18885,szymański pasztet pieczony kg 
11460,18886,anna pączek mini kg 
11461,18887,szim bułka z serem szynką szt 
11462,18888,mal piek bułka na zakwasie z otrębami g 
11463,18889,anna ptysie mini kg 
11464,18890,anna ciastka bezik kg 
11465,18891,ozimek pieczeń z indyka kg 
11466,18892,ozimek parówki delikatesowe z indyka kg 
11467,18893,wędliny od zawsze wędzonka krotoszyńska surowa kg 
11468,18894,niemann rogale kg 
11469,18895,mark s kiełbasa zielonogórska kg 
11470,18897,chmarzyński wędzonka farmerska kg 
11471,18898,swojscy schab cygański kg 
11472,18899,wawrów bułka dyniowa g 
11473,18900,sokołów polędwica z warzywami kg 
11474,18901,hert marcepanki kg 
11475,18902,miłosław pączek ze śmietaną szt 
11476,18903,kilian babka z mandarynką z metrą kg 
11477,18904,laskowski kostka malinowo morelowa kg 
11478,18905,laskowski kostka słoneczna kg 
11479,18906,ojcowa krakowska sucha kg 
11480,18907,gustavus schab hetmański kg 
11481,18908,gustavus szynka w siatce kg 
11482,18910,sendal ciastko jogurtowe z owocam joguś szt 
11483,18911,anna ciastko języczki szt 
11484,18913,kozłowski kiełbasa swojska kg 
11485,18914,korona polęndwica wiśniowa kg 
11486,18915,gustavus baleron kg 
11487,18918,mik mar chruścik kg 
11488,18920,gs wijewo biszkopt tortowy kg 
11489,18921,smoliński smalec kg 
11490,18922,sendla muffina marchewkowa szt 
11491,18923,ozimek baton szynkowo drobiowy kg 
11492,18924,niewieścin parówki codzienne kg 
11493,18926,la lorraine półbagietka wieloziarnista g 
11494,18927,chabura kiełbasa drwala kg 
11495,18928,chabura szynka od górali kg 
11496,18930,anna bułka szpinakowa szt 
11497,18931,różyccy złoty kurczak kg 
11498,18933,różyccy szynka z komina kg 
11499,18935,anna ciastko rurka z kremem szt 
11500,18936,kds smaczek konserwowy kg 
11501,18937,maxpol polędwica sopocka kg 
11502,18938,ściborów pasztet borowikowy kg 
11503,18939,ścibiorów biała parzona z majerankiem kg 
11504,18940,maxpol boczek paski rodzinne kg 
11505,18941,ściborów szynka swojska kg 
11506,18942,ścibiorów pasztet borowikowy mały kg 
11507,18944,pabich chleb razowy szt 
11508,18945,pabich chleb baltona g 
11509,18947,korona szynkowa z pieprzem kg 
11510,18948,nowak szynkówka kg 
11511,18949,korona kiełbasa podwawelska kg 
11512,18950,pib polędwica sopocka kg 
11513,18952,kuczora ciastka z cukrem kg 
11514,18953,miłosław sernik kg 
11515,18954,rolmops śledziowy smaż w pomid kg 
11516,18955,viola kresowiak kg 
11517,18956,witmas kiełbasa podwawelska kg 
11518,18957,la pettite makowiec z jabłkiem kg 
11519,18958,sandra amertykanka szt 
11520,18959,przewoźny kabanosy kg 
11521,18961,przewoźny kiełbasa zwyczajna kg 
11522,18962,przewoźny kiełbasa białostocka kg 
11523,18963,przewoźny pasztet wędzony kg 
11524,18964,la pettite kostka adwokat kg 
11525,18965,przewoźny smalec kg 
11526,18966,olsza canneloni mini kg 
11527,18967,przewoźny salceson kg 
11528,18968,lisner pasta z łososia kg 
11529,18969,śledz w sosie curry kg 
11530,18970,laskowski kostka rajskie jabłko kg 
11531,18971,la petite rolada firmowa kg 
11532,18973,la pettita torcik mini szt 
11533,18974,nowak serdelki delikatesowe kg 
11534,18975,sokołów śląska korona kg 
11535,18976,przewoźny kaszanka kg 
11536,18977,przewoźny ogonówka kg 
11537,18978,biegun szynka z fileta z kurczaka kg 
11538,18979,laskowski kostka rafaello kg 
11539,18981,marcepan wiosenne orzeźwienie z metra kg 
11540,18984,nova ciasto orzechowiec kg 
11541,18992,piekuś bagietka chia g 
11542,18995,grześkowiak sałatka makaronowa z szynką ogórkiem i kukurydzą kg 
11543,18996,niewieścin kiełbasa z czosnkiem niedźwiedźim kg 
11544,18998,drobex kiełbaski koktajlowe z serem kg 
11545,19005,michałowe pieczeń pyszna kg 
11546,19006,wędliny od zawsze kiełbasa krakowska z fileta kg 
11547,19007,swojscy polędwica sopocka kg 
11548,19008,mięso wieprzowe kg 
11549,19009,mięso wieprzowe kg 
11550,19010,łukosz kiełbasa polska pieczona kg 
11551,19011,la lorraine kostka bounty szt 
11552,19012,la lorraine adwokatki szt 
11553,19013,nuggetsy panierowane z mintaja kg 
11554,19014,anna biszkopciki kg 
11555,19015,swojski stragan parówki wiedeńskie kg 
11556,19018,skiba parówki bydgoskie kg 
11557,19019,viola szynka królewska 
11558,19023,miłosław babka szt 
11559,19024,miłosław babeczki szt 
11560,19025,miłosław beza ze śmietaną szt 
11561,19026,bigosowe z wędzonek kg 
11562,19027,gustavus boczek farmeski kg 
11563,19028,witmas kiełbasa piwna kg 
11564,19029,przewoźny parówki kg 
11565,19030,ogórki kiszone kg 
11566,19031,ozimek polędwiczka kg 
11567,19032,ozimek kiełbasa żywiecka z indyka kg 
11568,19033,sandra sernik malina szt 
11569,19036,marcepan rolada szpinakowa kg 
11570,19037,kabanos szynka kniazia kg 
11571,19038,niewieścin udko wędzone kg 
11572,19039,miłosław rogal kg 
11573,19040,gustavus polędwica łososiowa kg 
11574,19041,matro kiełbasa krucha kg 
11575,19042,jagódka mini torcik szt 
11576,19043,jagódka ptysie mini z budyniem kg 
11577,19044,nickal salaka suszona kg 
11578,19046,viola parówki cieńkie kg 
11579,19048,gustavus szynka z komina kg 
11580,19049,laskowski kostka brzoskwiniowo czekoladowa kg 
11581,19050,laskowski kostka jogurtowa z owocami kg 
11582,19051,cukruś stokrotki luz 
11583,19052,cukruś ciastka muszelki kg 
11584,19053,cukruś ciastka kruche kg 
11585,19054,cukruś piernik z pianką kg 
11586,19055,cukruś ciastka domowe kg 
11587,19056,ściborów kiełbasa śląska kg 
11588,19057,ściborów pieczeń pizza kg 
11589,19058,magdziarz bułka bajgiel z sezamem szt 
11590,19060,witmas kiełbasa zwyczajna kg 
11591,19061,marciszyn kurczak maślany z pieca kg 
11592,19062,frykadele rybne w pomidorach kg 
11593,19063,marcepan mini ptyś kg 
11594,19064,pomidor żółty kg 
11595,19066,przewoźny mielonka kg 
11596,19067,wesoła rodzinka mix kiełbas tradycyjnych kg 
11597,19068,wesoła rodzinka mix wędzonek tradycyjnych kg 
11598,19069,ozimek boczek paski na ciepł kg 
11599,19071,przewoźny krakowska parzona kg 
11600,19072,sofio ciastka francuskie deja vu luz 
11601,19073,piekuś tort halloween dynia g 
11602,19077,sendal pączek kwadratowy z nadzienem wiśniowym szt 
11603,19078,morliny mielonka tyrolska kg 
11604,19081,kwiecińscy babka pałucka kg 
11605,19082,morliny szynka konserwowa drób kg 
11606,19083,smaruj miód faceliowy ml 
11607,19084,smaruj miód faceliowy ml 
11608,19085,smaruj pyłek kwiatowy g 
11609,19086,smaruj miód akacjowy ml 
11610,19087,smaruj miód akacjowy ml 
11611,19088,piekuś korzenna delicja g 
11612,19089,mochy chleb baltonowski g 
11613,19092,lukullus przysmak kanapkowy kg 
11614,19093,gustavus pieczeń rzymska kg 
11615,19094,morliny konserwa drobiowa kg 
11616,19095,szymański pasztetowa wędzona kg 
11617,19096,animex mielonka tyrolska kg 
11618,19097,sendal ciasto marchewka pod śniegiem kg 
11619,19098,prosiaczek wędzonka boczkowa wędzona kg 
11620,19099,prosiaczek boczek wędzony bez kości bez skóry kg 
11621,19100,mik mar pawełek g 
11622,19101,magdziarz bajgel z sezamem g 
11623,19102,grygier rogaliki z białym makiem kg 
11624,19103,gustavus schab polski kg 
11625,19105,kasler schab wędzony kg 
11626,19106,mochy rogale półfrancuskie z białym makiem kg 
11627,19107,mik mar rogal marciński kg 
11628,19108,la lorraine monokl z cynamonem g 
11629,19110,la lorraine rogaliki marcina kg 
11630,19111,wawrzyniak rogal z makiem kg 
11631,19112,tuliszków rogal szt 
11632,19114,la petite rogal nekielski szt 
11633,19115,sandra rogal z makiem szt 
11634,19116,sandra rogal z dżemem szt 
11635,19117,wędliny od zawsze wątrobianka kg 
11636,19118,indykpol pieczeń z indyka z wątróbką i jabłkiem kg 
11637,19122,hert rogale świętomarcińskie kg 
11638,19124,alsa kotlet mielony wieprzowy g 
11639,19125,alsa kotleciki drobiowe g 
11640,19126,grzybowo kluski leniwe kg 
11641,19127,marcepan jesienny grzaniec kg 
11642,19128,marcepan ciasto cherry kg 
11643,19129,sójka rogal nadziany g 
11644,19131,lubasz ciasto chorwacja kg 
11645,19132,chabura szynka kasztelana kg 
11646,19133,dobra marka szynka nie ze wsi kg 
11647,19134,kabanos kiełbasa wiejska tradycyjna kg 
11648,19136,viola kabanosy xl kg 
11649,19137,gustavus kiełbasa biała kg 
11650,19138,sława pasztet borowy z jagnięciną kg 
11651,19140,wędliny od zawsze kiełbasa piwna kg 
11652,19141,wójcik ciastka grzybki kg 
11653,19142,wójcik ciastka orzeszki kg 
11654,19143,duda pieczeń z kaczką kg 
11655,19144,miłosław piernik kg 
11656,19145,wesoła rodzinka żywiecka z wędzarni małej masarni kg 
11657,19147,wawrzyniak piernik czekoladowy kg 
11658,19148,wawrzyniak piernik lukrowany kg 
11659,19149,niemann krajanka piernikowa kg 
11660,19150,gzella kabanosy z kociewskiej wędzarni kg 
11661,19151,gzella szynka z kociewskiej wędzarni kg 
11662,19152,gzella kiełbasa z kociewskiej wędzarni kg 
11663,19153,gzella kiełbasa myśliwska kg 
11664,19155,biegun udo z indyka pieczone kg 
11665,19156,ozimek filet gotowany z piersi kg 
11666,19159,wójcik ciasto chatka kg 
11667,19160,wójcik ciasto kopiec kreta kg 
11668,19161,wójcik rogaliki z marmoladą kg 
11669,19163,wójcik ciasto rwaniec z serem kg 
11670,19164,hert puchatki kg 
11671,19166,piekarnia rodzinna kirschhiebel kostka piernikowa kg 
11672,19167,maratońska pierniki z lukrem kg 
11673,19173,hańderek szynka extra ciemno wędzona kg 
11674,19176,gzella kruszynki kg 
11675,19177,gzella serdelka z borów kg 
11676,19181,skupin bułka wyborowa g 
11677,19182,skupin bułka wyborowa g 
11678,19183,skupin chleb bamberski g 
11679,19189,skupin chleb o niskiej zawartości glutenu g 
11680,19192,skupin chleb rawicki krojony g 
11681,19193,skupin chleb rawicki krojony g 
11682,19197,skupin pączek szt 
11683,19199,skupin pączek z toffi szt 
11684,19202,skupin pączek z porzeczką szt 
11685,19203,skupin pączek z powidłami szt 
11686,19208,skupin sernik krakowski z rodzynką kg 
11687,19211,skupin makowiec zwijany kg 
11688,19212,skupin strucla makowa z kruszonką kg 
11689,19213,skupin jabłecznik kruchy kg 
11690,19216,skupin babka firmowa biała kg 
11691,19222,skupin chmurka kawowa kg 
11692,19224,skupin popapraniec kg 
11693,19225,skupin jogurtowe orzeźwienie kg 
11694,19229,skupin rogaliki kg 
11695,19230,skupin kieszonki z morelą kg 
11696,19231,skupin mini pączki kg 
11697,19232,skupin oponki kg 
11698,19233,skupin babeczki z maliną kg 
11699,19234,skupin babeczki ze śmietaną kg 
11700,19237,skupin ptyś kg 
11701,19238,skupin tort kg 
11702,19239,pychota ziemniaczki pieczone kg 
11703,19240,laskowski kostka cytrynowa kg 
11704,19241,grobelski pizzerinka toskańska szt 
11705,19242,wójcik ciasto pewniak kg 
11706,19243,haga kiełbaski śląskie drobiowe kg 
11707,19244,turek grand blue ser z niebieską pleśnią kg 
11708,19246,łuków pasztet jubileuszowy kg 
11709,19247,wójcik ciasto rubinka kg 
11710,19249,pestki dyni kg 
11711,19253,wiwa kiełbasa rycerska kg 
11712,19254,kabanos kiełbasa śląska regionalna kg 
11713,19255,pekpol szynka konserwowa kg 
11714,19256,tarczyński kiełbasa myśliwska premium kg 
11715,19257,olsza sernik z polewą kg 
11716,19258,olsza bułeczki waniliowe kg 
11717,19259,maratońska ciasto słonecznikowe kg 
11718,19260,e j klimaccy slaceson z ziołami kg 
11719,19261,marcepan ciasto mleczna zebra kg 
11720,19262,spomlek ser kamrat kg 
11721,19263,młynarczyk krajanka piernikowa g 
11722,19264,danone actimel truskawka szt 
11723,19265,hańderek klops z piekarnika kg 
11724,19266,wędliny od zawsze pasztet drobiowy kg 
11725,19267,karp filet b s kg 
11726,19268,śledzie w sosie tatarskim kg 
11727,19271,smoliński pasztet z cebulą dymką kg 
11728,19272,smoliński kkiełbasa hiszpańska podsuszana kg 
11729,19275,pitahaya czerwona wietnam szt 
11730,19276,gustavus szynkowa wędzona kg 
11731,19277,swojski stragan szynka sołtysa kg 
11732,19278,la pettite sernik z jabłkiem kg 
11733,19279,maxpol rolada dziadka maksa kg 
11734,19280,dolina dobra szynka bez konserwantów kg 
11735,19281,marcepan strucla serowa g 
11736,19282,marcepan strucla makowa g 
11737,19284,olsza baletki kg 
11738,19285,sandra piernik suchy kg 
11739,19286,sandra piernik lukier i czekolada kg 
11740,19287,sandra krajanka piernikowa kg 
11741,19288,la lorraine krajanka piernikowa kg 
11742,19289,farmer mielone z pieca kg 
11743,19290,farmer gołąbki kg 
11744,19291,twaróg krajanka półtłusty włocławek kesem 
11745,19292,farmer szaszłyki z pieca kg 
11746,19294,prosiaczek smakusie dziecięce kg 
11747,19300,chrupek kostka piernikowa kg 
11748,19302,sendal ciasto sernik kg 
11749,19303,sendal ciasto sernik kg 
11750,19304,sendal ciasto sernik z owocami kg 
11751,19306,farmer roladki z fileta kg 
11752,19307,seko śledzie ze śliwką kg 
11753,19308,uni pal kiełbasa biała parzona kg 
11754,19309,uni pal kiełbasa bamberska kg 
11755,19310,uni pal kiełbasa śląska kg 
11756,19311,uni pal kiełbasa polska wędzona kg 
11757,19312,uni pal kielbasa polska pieczona kg 
11758,19313,uni pal bekon kg 
11759,19314,uni pal boczek wędzony kg 
11760,19315,uni pal boczek w ziołach kg 
11761,19316,uni pal szynka myszka wędzona kg 
11762,19317,uni pal szynka myszka gotowana kg 
11763,19318,uni pal szynka zrazowa wędzona kg 
11764,19319,uni pal szynka z wiochy kg 
11765,19320,uni pal leberka wędzona kg 
11766,19321,uni pal filet wędzony z kurczaka kg 
11767,19322,uni pal polędwiczka wędzona z indyka kg 
11768,19323,uni pal twaróg wędzony szt 
11769,19324,piekuś tort pralinowa malina kg 
11770,19326,aves paprykarz drobiowy szt 
11771,19327,dorsz tusza kg 
11772,19328,gospodarstwo pasieczne radosław zieliński miód pszczeli ml 
11773,19329,konecke salami trapez z ziołami kg 
11774,19330,dolina dobra boczek wędzony parzony kg 
11775,19331,korona łopatka szlachecka kg 
11776,19332,farmer krokiety ziemniaczane z mięsem kg 
11777,19334,witmas pieczeń rzymska kg 
11778,19335,korona szynka szlachcica kg 
11779,19336,indykpol pasztet z indyka i gęśiną kg 
11780,19337,indykpol sztuka mięsa z indyka wolnogotowana kg 
11781,19338,viola szynka toruńska kg 
11782,19339,zestaw czerwona kokarda szt 
11783,19340,zestaw zielona kokarda szt 
11784,19341,zestaw niebieska kokarda szt 
11785,19342,łuków pasztet jubileuszowy z grzybami kg 
11786,19343,zestaw biała kokarda szt 
11787,19344,kilian piernik złocisty kg 
11788,19345,zestaw świąteczny piernik szt 
11789,19346,zestaw blask świąt szt 
11790,19347,mozzarella maestrella kg 
11791,19348,dolina dobra szynka wędzona kg 
11792,19359,pruchnik boczek rolowany kg 
