,code,product_name
0,115,przecena warzywa kg 
1,125,przecena warzywa szt 
2,131,przecena spożywka 
3,132,przecena spożywka 
4,133,przecena spożywka 
5,134,przecena spożywka 
6,135,przecena spożywka 
7,136,przecena spożywka 
8,921,przecena spożywka kg 
9,1280,przecena spożywka kg 
10,1322,przecena spożywka 
11,1471,przecena spożywka 
12,1545,przecena spożywka 
13,1546,przecena spożywka 
14,1704,przecena spożywka kg
15,4528,ksero a kolor
16,4529,ksero czarno białe
17,4530,ksero czarno białe dwustronne
18,4531,ksero a kolor
19,4532,ksero a kolor dwustronne
20,1082,skrzynka pepsi 
21,11176,usługa kurierska
22,531,butelka krzyś
23,247,usługa marketingowa
24,12910,opłata za udostepnienie miejsca pod lodówkę so
25,1107,butelka wino l
26,547,skrzynka wino
27,16047,butelka zwrotna
28,12123,przecena vat 
29,1103,butelka pepsi l
30,0,doładowania telefoniczne
31,1106,butelka piwo l żywiec
32,17280,usługa promocyjna
33,17495,wypożyczenie sprzętu skakanka
34,17496,wypożyczenie sprzętu frisbee
35,17497,wypożyczenie sprzętu hula hop
36,17498,wypożyczenie sprzętu kólko do ćwiczeń
37,17500,wypożyczenie sprzętu siatka do tenisa stołowego
38,17501,wypożyczenie sprzętu zestaw do tenisa stołowego
39,17502,wypożyczenie sprzętu zestaw do badmintona
40,17503,wypożyczenie sprzętu dart elektrzyczna tarcza do gry w rzutki
41,17504,wypożyczenie sprzętu kijki do nordic walking
42,17507,kaucja hula hop
43,17510,kaucja siatka do tenisa stołowego
44,17511,kaucja zestaw do tenisa stołowego
45,17513,kaucja dart elektroniczna tarcza do gry w rzutki
46,17514,kaucja kijki do nordic walking
47,12119,przecena zł
48,9898987,test
49,17783,spławik lorpio red star 
50,17784,spławik lorpio gold star 
51,17785,spławik lorpio gold star 
52,17786,toaleta płatna oo zł
53,17799,wypożyczenie sprzętu piłka nożna
54,17499,wypożyczenie sprzętu piłka do koszykówki
55,17800,wypożyczenie sprzętu okulary do pływania
56,17801,wypożyczenie sprzętu rakietka do tenisa stołowego
57,17508,kaucja kółko do ćwiczeń
58,17506,kaucja frisbee
59,17505,kaucja skakanka
60,17796,kaucja piłka nożna
61,17509,kaucja piłka do koszykówki
62,17512,kaucja zestaw do badmintona
63,17798,kaucja okulary do pływania
64,17797,kaucja rakietka do tenisa stołowego
65,17848,ogród jabłoń
66,17846,ogród paeonia piwonia
67,17850,ogród śliwa
68,17852,ogród nektarynka
69,17854,ogród gruszka
70,17856,ogród wiśnia
71,17860,ogród czereśnia
72,17861,ogród rododendron
73,17864,ogród agrest
74,17866,ogród porzeczka
75,10874,zapalniczka szara szt
76,10875,zapalniczka make your day
77,17609,pudelko skladane
78,17960,koperta ozdobna mini
79,17908,zapalniczka prezent
80,17913,maseczka na twarz
81,18089,łubin kwiat
82,18128,alfa płyn nabłyszczający do zmywarek l automatic
83,18127,magnetis stopki 
84,18136,magnetis stopki z koronką
85,18129,alf płyn do zmywarek automatic al l
86,18148,ariel kapsułki do prania color szt
87,18149,ariel kapsułki do prania czerń szt
88,18150,ariel kapsułki do prania biel szt
89,18169,bilet normalny zł
90,17157,wino mix ml
91,12438,niezbędnik urodzinowy pudełko
92,461,wieszak samoprzylepny
93,9486,bnn obrus pcv świąteczny x 
94,11125,świecznik wysoki
95,11128,wazon butelka
96,11139,świecznik wysoki
97,13194,bombka op
98,13108,ramka przecena
99,3505,ags słoje l 
100,4142,taśma opakowaniowa x clear akryl 
101,4330,petarda ls 
102,4366,balon serce szt
103,51572,sed kadzidełka podstawek narta 
104,6061,dekoracja świąteczna wianek duży
105,10392,kosz wiklinowy dk d
106,10912,figurka sowa średnia
107,10922,magnesy na lodówkę szt
108,10932,ala pol brelok pompon
109,10934,ala pol spinka perła
110,10935,ala pol zawieszka do kluczy
111,10937,ala pol opaska plastikowa mix kolorów
112,10938,ala pol pierścionek
113,10939,ala pol gumka groszki
114,10940,ala pol opaska czarna
115,10941,ala pol gumka do włosów kokardka
116,10942,ala pol gumka z kulką
117,11012,bazie mini szt
118,11015,gałęzie kolorowe szt
119,11877,świecznik ht
120,14071,ravi wyspa okazji zl
121,14526,o_transporter lemoniada zł
122,14527,o_pojemnik gniazdowy
123,14890,torebka świąteczna mała niebieska szt
124,14892,worki świąteczne szt
125,14893,zemar opaska szt
126,14900,wielkanocne kurczaki małe szt
127,14903,wielk gniazdo ptasie z jajkami szt
128,15109,organza cm m
129,15110,figi carolina pełne
130,15111,limonka suszona
131,15117,rękawiczki tekstylne szt
132,15120,świeca serce szt
133,15125,złoty krążek śr szt
134,15128,podkoszulki damskie szt
135,15129,taśma ozdobna kokon szt
136,15131,świeca walec 
137,15140,figi damskie x o
138,15142,świeczki kulki mix szt
139,15144,gumka do włosów szt
140,15156,koszyk 
141,15161,pamiątka okolicznościowa szt
142,15990,koszt kajet półka biurowa plastikowa
143,16000,koszt eltrox sejf ax samson
144,16363,ciężarek ołowiany mały
145,16723,koszt girlanda zielona cm
146,16725,koszt girlanda choinkowa świąteczna cm delux
147,1312,ags fi a zakrętka
148,11410,taca plast prost
149,15033,zakrętka fi op szt
150,17436,alsa surówka meksykańska z białej kapusty g
151,2848,gwiazda betlejemska szt
152,12753,lizak chupa smoth creamy g
153,17879,medicaline lizak mix g
154,14538,lizak kulisty truskawka g
155,16607,kwieciński piekarnia gorąca czekolada duża premium ml
156,16610,kwieciński piekarnia gorąca czekolada mała ml
157,18189,art spożywcze 
158,18190,art spożywcze 
159,18188,art spożywcze 
160,10666,vobro cukierki mix luz
161,12754,żelki barwiące węże g
162,420,kokosanka papieskie kremówki szt
163,1646,kokosanka pianka truskawkowa kg
164,2658,mariolli pączek szt
165,2740,mariolli babka ciemna kg
166,1678,mizar babka korzenna g
167,1703,jagódka babka w polewie kg
168,1,drożdże piekarskie prasowane stantard g
169,14642,mik mar opłatek na tort szt
170,16336,jagódka zdjęcie opłatkowe na tort szt
171,14099,napoj fanta
172,15739,lemoniada ml
173,17788,rhd syrop z liści mięty natury ml
174,17790,rhd syrop z kwiatu czarnego bzu natury ml
175,17889,rhd syrop z aronii naturalny ml
176,17890,rhd syrop truskawkowy natualny ml zakup
177,17891,rhd syrop z czarnej porzeczki naturalny
178,17907,rhd syrop wiśniowy naturalny ml
179,145,przecena nabiał szt 
180,148,przecena nabiał szt 
181,1620,przecena nabiał szt 
182,15619,kawa latte
183,15620,kawa flat white
184,15621,kawa americano
185,15622,kawa americano
186,15623,kawa cappuccino mała
187,15624,kawa espresso
188,15625,herbata czarna
189,15627,herbata
190,15628,herbata owocowa
191,15629,kawa mrożona soda
192,15630,kawa mrożona welcome wietnam
193,15631,kawa mrożona marakuja
194,15632,kawa mrożona kokos
195,15633,kawa mrożona z lodami
196,15634,kawa mrożona espresso tonik
197,15642,kawa mrożona frappe
198,15643,kawa mrożona iced latte
199,15644,kawa mrożona strawberry latte
200,15646,kawa mrożona sweet and salty
201,15648,kawa mrożona affogato
202,16614,kwieciński piekarnia herbata zimowa ml
203,4583,sendal pierogi z kapustą i grzybami kg
204,6083,mniaam mniaam kapusta z grochem na luz kg
205,6504,mniaam mniaam surówka kg
206,1285614,bagietka kanapka g
207,16154,bagietka bajgiel z twarożkiem g
208,16157,bagietka kanapka z tuńczykiem i jajkiem g
209,16227,bagietka lunch box chińskie z kurczakiem i ryżem g
210,16261,bagietka lunch box humus ze świeżymi warzywami g
211,16303,bagietka lunch bx dorsz z ryżem i warzywami g
212,4365,balon mix kolorów szt
213,17489,bagietka kanapka z gril kurczak g
214,14190,o_transporter rzepinianka gniazd
215,5253,deska szkło hart
216,18251,solmed gyros szt
217,18254,solmed carpaaccio szt
218,18256,solmed galaretka drobiowa szt
219,18253,solmed jajka w sosie szt
220,18255,solmed kanapka szt
221,18252,solmed sałatka fit szt
222,18283,bobrówko syrop ziołowy ml
223,18295,karnet ulgowy pięcioprzejazdowy szt
224,18308,lody włoskie małe szt
225,18307,lody włoskie duże szt
226,18325,kaczmarczyk maść propolisowa ml
227,4936509,coca cola ml vanilla pusz
228,18380,usługa informacyjno handlowa
229,16159,bagietka sałatka cezar g
230,16160,bagietka sałatka z kurczakiem g
231,10675,mniaam mniaam bułka biała szt
232,10676,mniaam mniaam bułka ciemna omega szt
233,5384,sendal prawdziwy żurek z naszej piekarni szt
234,657,społem bułka wyborowa g
235,18351,x treme sour potty wc lizak g
236,13907,luz cuk pszczolka blue ice kg
237,13908,luz cuk hildebrand zajaczki w czekoladzie kg
238,14741,mieszko cuk klejnoty pis
239,16640,paczka świąteczna
240,16641,paczka świąteczna premium
241,2513,wawel cukierki luz strefa czerwona
242,3932,ptasie mleczko luz
243,13917,luz cuk jedność ciut luz
244,13918,luz cuk roksana gumiaki luz
245,13919,luz cuk roksana mieszanka cytrusowa luz
246,13920,luz cuk roksana kulki balonowe luz
247,13922,luz cuk roksana emo tki luz
248,13923,luz cuk milano mieszanka fantastyczna luz
249,13924,luz cuk śnieżka pasty maczek luz
250,13925,luzuk mieszanka mix luz
251,13926,luz cuk magnat galaretka w czekoladzie luz
252,13928,luz cuk vobro wisnie jednoskret luz
253,13929,luz cuk krówka polska luz
254,13931,luz cuk żelki drucela candy luz
255,13932,luz cuk solidar złoty adwocat luz
256,13933,luz cuk gibar toffix luz
257,13934,luz cuk mieszko tutti frutti kg
258,13936,luz cuk słowianka smigle luz
259,13939,luz cuk słowianka iglo lodowe kg
260,13941,luz cuk vobro marcepan nadziewany luz
261,13944,luz cuk krówka milk luz
262,13948,luz cuk vobro wisnie likier luz
263,13950,luz cuk polly krówka luz
264,13952,luz cuk polly krówka luz
265,13955,luz cuk hibbi jajko luz
266,13962,luz cuk dobosz toffi czekoladowe luz
267,16109,solidarność cukierki złoty orzech luz
268,16110,storck cukierki kopiko luz
269,17469,pszczółka cukierki mix luz
270,6310,gassowscy jajeczka wielkanocne kg
271,15671,cukierki wiśnie w likierze vobro
272,14269,wn jajka czekoladowe z nadzieniem kakaowym luz
273,14740,unitop kukułki luz
274,14752,spiffy cuk pomorz luz
275,12780,an ba toy magic tracks zn
276,13658,guma eyes with centerfil g
277,5970689,mondelez halls lime fresh flavour g
278,17814,mix cukierki argo
279,12831,cuk chrupiace serduszka luz
280,17630,cukierki minky binky roshen luz
281,17631,cukierki jumi roshen luz
282,17634,cukierki dobosz mleczko luz
283,17637,cukierki ancymonki luz
284,14369,jajka marcepanowe białe luz
285,2168,śliwka w czekol luz
286,4799,ufo opłatek z proszkiem musującym szt tub
287,13910,cuk raffaello szt
288,12756,ewa cukierki karm czek pomaranczowe luz
289,4173,pepermint karmelki nadz miętowe
290,13975,luz ciast piernik luz
291,13977,luz ciast piernik katarzynka luz
292,4565,sendal ciastka zbożowe kg
293,13973,luz ciast śnieżka wafle michałki luz
294,15079,ciasta chrupki w czekoladzie kulki luz
295,15735,cukierki mister ron luz
296,15736,cukierki fantazja deserowa luz
297,12654,esta chrupki w polewie luz
298,13982,luz ciast ciach pol ciastka marmolada luz
299,13983,luz ciast ciach pol markizy luz
300,6212,rurka z kremem kg
301,17775,brzeziecki łukasz pieczarki marynowane g
302,5328,marynata kg
303,14739,sos hot dog
304,15737,sos czoskowy
305,16116,kwieciński garnażerka sos ziołowy ml
306,16118,kwieciński garnażerka sos czoskowy ml
307,18246,kamis mix przypraw promocja g g
308,18284,bobrówko ocet jabłkowy ml
309,16372,cement
310,16373,art budowlane
311,2499,bratek szt
312,3031,danflor róża
313,624508,motyczka jednopałą trapez
314,1483,kwiat zamio
315,3405,gnaphalium
316,10959,danlfor sansevieria
317,10960,dendrobium
318,10961,medinilla
319,10964,marstera
320,11966,wiatrak średni
321,11969,wiatrak duży
322,13859,araukaria szt
323,14564,łopatka piaskowa z trzonkiem
324,16872,gauteria
325,2391,szafirek
326,6264,świerk gałązka szt
327,11959,pelargonia wieloletnia szt
328,11965,wiatrak mały
329,12048,kwiat skrzydłokwiat
330,12425,kwiat paprotka duża
331,12428,kwiat monstera
332,12913,wrzos korona
333,14069,lopata d sniegu
334,14100,nasiona warzyw kielki szt
335,14101,nasiona kwiaty ziola szt
336,14102,nasiona grupa kwiat warzywa kielki
337,14103,ogrod buty kalosze chodaki czarne
338,14104,ogrod buty kalosze damskie elke 
339,14105,ogrod buty obuwie kalosze meskie filcak 
340,14106,ogrod buty klapki doctor 
341,14107,ogrod kije ogniskowe szt
342,14109,ogrod kwiat stokrotka
343,14111,ogrod mata wiklinowa x cm szt
344,14112,ogrod mata wiklinowa xcm szt
345,14113,ogrod palik drewno d pom xcm
346,14116,ogrod keramzyt ogrodniczy mm op l
347,14118,ogrod kwiat pelargonia
348,14119,ogrod keramzyt ogrodniczy mm op l
349,14120,ogrod kwiat begonia duza szt
350,14121,ogrod kwiat begonia mala turek szt
351,14122,ogrod kwiat prymulka szt
352,14124,ogrod lampa olej nafta niebies cm szt
353,14125,ogrod buty kalosze dzieci kolmax 
354,14126,ogrod kamien bialy kg
355,14127,ogrod kamien otaczak thassos mm
356,14128,ogrod kamien kora kamienna kg
357,14129,ogrod kamien kruszywo omyadol kg
358,14130,ogrod kamien grys bazaltowy kg
359,14133,ogrod kamien grys granitowy kg
360,14134,ogrod agrecol nawoz d borowek kg
361,14135,ogrod kwiat komarzyca sanwital basota szt
362,14136,ogrod przecana
363,14137,ogrod kwiat ample szt
364,14138,ogrod kwiat niecierpek szt
365,14140,ogrod kwiat pelargonia surfinia szt
366,14141,ogrod lawenda szt
367,14169,dz borowinnowy konc pro peat l
368,14170,dz solanka l
369,14172,dz trym r pg
370,14173,dz obrzeze border m szpilki
371,14175,dz oase zarnik w
372,14176,dz florovit do trawnikow kg
373,14177,dz materac
374,14178,dz nutraminiuk
375,14180,dz hollas
376,14182,nasiona sezon mix szt
377,14184,ogrod misa roma cm biala
378,14185,ogrod lubin donica szt
379,14187,dz agrecol d hortensji l
380,14340,kwiat storczyk
381,14341,kwiat guzmania
382,14342,kwiat guzmania
383,14343,kwiat nerina
384,14344,kwiat neregeria
385,14345,kwiat anturium
386,14565,szpadel prosty hartowany trzon
387,14845,koszyczki wielorazowego użytku szt
388,14093,ogrod rudbekia owlosiona szt
389,14094,ogrod przetacznik klosowy szt
390,14108,ogrod truskawki sadzonki szefa szt
391,14110,ogrod rekawice robocze bestingi
392,14115,ogrod rekawiczki drelichowe
393,14117,ogrod worek polipropylenowy szt kg
394,14131,wed splawiki lorpio river g
395,14132,wed splawiki lorpio bream g
396,14139,ogrod trzmielina euonymus japonicus szt
397,14144,ogrod roza drzewko szt cm c
398,14186,ogrod rozanecznik miniaturowy c
399,14188,ogrod przecena 
400,14189,ogrod sznurek budowlany zolty m
401,14413,ample szt
402,14820,węd koszyczki zanętowe mm g
403,14821,węd spławiki lorpio g
404,14824,ogród zamiatacz magazynowy
405,14825,zemar zawieszki d kluczy szt
406,14827,węd koszyczki zanętowe mm g
407,14828,węd spławiki lorpio bream blubery 
408,14829,węd spławiki lorpio g
409,14831,węd spławiki lorpio bream g
410,14832,węd wypychacz dwustronnie wygięty
411,14833,ogród rolborder x x 
412,14834,węd koszyczki zanętowe mm g
413,14836,węd żyłka trabucco t force competition pro mm m
414,14837,ogród keramzyt doniczkowy mm op l
415,14838,węd spławiki lorpio lake g
416,14839,węd koszyczki zanętowe mm g
417,14840,węd spławiki lorpio gold star g
418,14841,węd spławiki lorpio gold star g
419,14843,węd spławiki lorpio g
420,14844,węd spławiki lorpio river pro classic g
421,14846,węd spławiki lorpio classic lake g
422,14847,węd spławiki lorpio bream g
423,14848,węd siatka lorpio super cm mm
424,14849,węd spławiki lorpio g
425,14850,węd spławiki lorpio classic lake g
426,14851,węd żyłka trabucco t force competition pro mm m
427,14856,węd spławiki lorpio red star g
428,14857,ogród rolborder x x 
429,14858,węd spławiki lorpio bream blubery 
430,14859,węd spławiki lorpio gold star g
431,14860,węd spławiki lorpio gold star g
432,14861,zemar rozeta duża metal
433,14862,węd spławiki lorpio bream pro g
434,14863,węd spławiki lorpio bream g
435,14864,węd spławiki lorpio classic multicolor g
436,14865,węd spławiki lorpio classic lake g
437,14866,węd wypychacz lorpio dwustronny wygięty
438,14867,węd koszyczki zanętowe mm g
439,14868,worki foliowe x szt
440,14869,worki folowe x szt
441,16374,agd
442,14156,borówka mała sz krzew poj l
443,14157,borówka duża szt krzew poj l
444,6063,donica wenecja grafit
445,14114,danlfor ogród azalia donica
446,14326,róża wielokwiatowa szt
447,14327,róża pnąca szt
448,14328,róża okrywowa szt
449,14593,rozsada warzyw
450,15126,róża cedrowa
451,16366,rurka antysplątaniowa
452,17470,s drabinki bambusowe gięte cm
453,17471,s drabinki bambusowe cm
454,10329,siatka do gipsu gran 
455,13389,siatka do gipsu gran 
456,14457,siatka lorpio super team eco cm m
457,14458,siatka lorpio super team eco cm m
458,15230,sk termometr zaokienny duży zwykły biały
459,15231,sk termometr zaokienny duży zwykły brązowy
460,16376,siatka na szynkę
461,16400,sanki
462,6810,standard perlator baterii ściennej x
463,6812,standard perlator baterii ściennejk x
464,14324,thuja szt
465,14455,spławik lorpio classic multicolor g
466,14456,spławik lorpio classic multicolor g
467,14461,spławik lorpio classic bream g
468,14462,spławik lorpio classic bream g
469,14463,spławik lorpio classic bream g
470,14464,spławik lorpio classic bream g
471,14465,spławik lorpio classic bream g
472,14466,spławik lorpio classic bream g
473,14467,spławik lorpio classic lake g
474,14468,spławik lorpio classic lake g
475,14469,spławik lorpio classic lake g
476,14470,spławik lorpio classic multicolor g
477,15099,śnieżynka brzoza
478,15106,szyszka
479,16369,stoper
480,16377,tabletki corega do protez a
481,16401,trzonek od siekiery cm
482,16402,trzonek od siekiery cm
483,16403,trzonek od siekiery cm
484,16404,trzonek od szpadla
485,16405,trzonek od łopaty
486,16406,trzonek od wideł
487,16407,trzonek od grabi
488,17063,spławik eldorado g
489,17064,spławik eldorado g
490,17065,spławik eldorado g
491,1050,v bud moltoprencm sr mm
492,10009,wałek microfibra cm
493,10671,zaślepka sześ ocynk
494,11843,wazon mały
495,14325,wierzba szt
496,14522,węd rurki antyspląt lorpio wygięta cm
497,14523,węd wypychacz mini szt
498,14524,węd spławiki trabucco ultimate x
499,14525,węd spławiki lorpio multicolor g
500,14528,węd spławiki lorpio bream blubery 
501,14529,węd spławiki lorpio river classic g
502,14530,węd spławiki lorpio river pro classic g
503,14534,węd spławiki lorpio river classic g
504,14535,węd spławiki lorpio green star g
505,14536,węd haczyki tab akura no szt
506,14553,wiadro szt
507,14586,wędkarski robak biały gruby
508,14587,wędkarski robak pinka
509,14588,wędkarski robak czerwony ml
510,14792,węd podbierak lorpio super eco m
511,14793,węd podbierak lorpio super team alu m
512,14794,węd spławiki lorpio bream blubery g
513,14796,węd ciężarki lorpio łezka krętik g szt
514,14797,węd ciężarki lorpio g
515,14798,węd haczyki tab akura no szt
516,14799,węd spławiki lorpio bream pro g
517,14802,węd koszyczki zanętowe mm g
518,14803,węd spławiki lorpio g
519,14804,węd haczyki tab akura no szt
520,14805,węd spławiki lorpio g
521,14806,węd spławiki lorpio gold star g
522,14807,węd rurki antysplątaniowe cm
523,14809,węd spławiki lorpio river g
524,14810,węd spławiki lorpio gold star g
525,14812,węd spławiki lorpio classic multicolor g
526,14813,węd koszyczki zanętowe mm g
527,14814,węd haczyki tra akura no szt
528,14887,węd spławiki lorpio bream blubery szt
529,14894,węd koszyczki zanętowe mm g
530,14895,węd spławiki lorpio gold star g szt
531,14896,węd koszyczki zanętowe mm g
532,14897,węd spławiki lorpio classic river g szt
533,15232,wędkarski robak czerwony rozm szt
534,15233,wędkarski robak czerwony rozm szt
535,15234,wędkarski robak czerwony rozm szt
536,15235,wędkarski robak kolor szt
537,15238,węd sprężyna znętaowa z dociążeniem g
538,15239,węd sprężyna znętaowa standard cm
539,15240,węd sprężyna znętaowa standard cm
540,17615,wędkarski robak kolor ml
541,12689,zawias splatany xx 
542,1071,gwoździe budowlane x
543,1175,emakol strong biały l
544,1277,fi aoc pn podkładka
545,1278,fi aoc pn podkładka
546,1279,fi aoc pn podkładka
547,1282,fi aoc pn podkładka
548,1287,fi aoc pn podkładka
549,1291,fi aoc pn podkładka
550,1513,euk cu miedz
551,2389,globex pilnik ślusarski płaski 
552,2396,globez pilnik ślusarski trójkątny 
553,2400,globex podkładka fi 
554,5290,bit pz mm
555,6015,grabie zębne nieoprawne
556,6068,elektroda fi 
557,6594,doniczka storczyk 
558,6665,cegła mokra oasis
559,6666,cegła sucha oasis
560,1048,kadzidełka podstawek
561,1176,klucz impusowy mm typ l długi kulka beta
562,1263,m pn nakrętka
563,1264,m oc pn nakrętka
564,1266,m oc pn nakrętka
565,1267,m oc pn nakrętka
566,1271,m pn nakrętka
567,1275,m oc pn nakrętka
568,1276,m oc pn nakrętka
569,1301,mx oc pn śruba
570,1302,mx oc pn śruba
571,1507,kolano cu 
572,1510,kolano cu miedz
573,606013,konewka l
574,606020,konewka l
575,3428,kołek rozporowy x nylon hak kątowy smart
576,4505,kosa ogrodowa krótka ręczna t cm
577,4524,mx oc śruba kg
578,606931,łopatka ogrodn szeroka drewn rączka
579,6105,kołek rozporowy hak 
580,6124,krążek ścierny na rzep p
581,6136,łańcuch do piły mm ogniw
582,6137,łańcuch do piły mm ogniw
583,6140,łańcuch do piły mm ogniwa
584,6347,lina stalowa x mm mm w pcv m b
585,6348,lina stalowa x mm mm w pcv m b
586,6350,łańcuch d fi m b
587,6351,łańcuch d fi m b
588,6352,łańcuch d fi m b
589,6353,łańcuch d fi m b
590,6581,hak balkonowy
591,6911,konewka oc l p z sitkiem
592,6771,łańcuch mm ocynk
593,1311,nasadka mm irwin
594,1705,papier krążek rzep mm
595,3427,obejma rury wydechowej
596,4150,płótno pls xmm 
597,4487,mufa cu lwxlw miedź
598,6144,nasadka mm
599,6145,nasadka mm
600,6146,nasadka mm
601,6149,nasadka mm
602,6150,nasadka mm
603,6151,nasadka mm
604,6152,nasadka mm
605,6153,nasadka mm
606,6154,nasadka mm
607,6155,nasadka mm
608,6158,nasadka długa mm
609,6160,nasadka długa mm
610,6161,nasadka długa mm
611,6170,opaska zaciskowa prima
612,653416,pistolet do podlewania
613,6793,opaska ślimakowa mm
614,6794,opaska ślimakowa mm
615,6795,opaska ślimakowa mm
616,6796,opaska ślimakowa mm
617,1051,tasma opakowaniowa brązowa akryl
618,1055,tasma opakowaniowa clear akryl
619,1512,trójnik cu miedz
620,6224,spryskiwacz kwiatek
621,6225,stalco wiertło do metalu 
622,6227,stalco wiertło do metalu 
623,6228,stalco wiertło do metalu 
624,6229,stalco wiertło do metalu 
625,6237,stalco wiertło do metalu 
626,6246,szpilka łączaca ocynk m
627,6253,sztyl do siekierki profil 
628,6257,śruba rzymska oko hak x
629,653426,rozpylacz z zaworem
630,6639,siatka ścierna gr 
631,6770,trzon do młotka cm
632,6271,wiertło do metalu mm milwakuee
633,6273,wiertło do metalu mm milwaukee
634,6274,wkręt do gipsu czarny kg
635,6278,yara mila complex kg
636,6288,zasuwa sprężynowa czarna drewniana rączka 
637,6611,wiadro ocynk l
638,12917,kawa z automatu mała
639,12918,kawa z automatu duża
640,15772,kawa cappuccino duża
641,16613,kwieciński piekarnia kawa latte z syropem ml
642,3840,lenor kapsułka szt
643,10883,persil kapsułki do prania szt
644,3861,ariel kapsułki active szt
645,10882,vizir kapsułki do prania szt
646,13312,sed odśw samochodowy areon miś a zestaw
647,6095,kapsułki do zmywarki fairy szt
648,50002,odświeżacz brise glade relaxing ml
649,8453,prz do rur super spec g
650,1111192,areon listki zapachowe szt
651,15135,złoty podkład szt
652,14066,serwety papierowe x szt
653,14067,serwety papierowe cm szt
654,14217,wed sprezyna zanetowa z dociazeniem g n rurce
655,14218,wed koszyczki zanetowe g
656,14219,wed pojemnik lorpio do zanent l
657,10015,wsuwki d włosów szt
658,14533,nożyki d gol blue slalom szt gillette
659,13227,bis diodowy wkładświetlik s biały
660,15093,bateria daniell lr aaa alkaline
661,15096,bateria daniell lr aa alkaline
662,15241,termometr zaokienny cm
663,16196,koszt citizen kalkulator cmb bk czarna biurkowy miejsc podwójne zasilanie
664,16200,koszt prolech przedłużacz pr wsp m gu x mm 
665,16392,wtyczka z włącznikiem
666,16647,koszty termowentylat gobi
667,16724,koszt lampki led na baterie led
668,17021,suszarka do włosów w concept
669,16252,spiner mm
670,154,reklamówka
671,15094,koszulka na dok a
672,10853,torba papierowa duża
673,10872,torba papierowa mała szt
674,11688,torba papierowa duża
675,15137,temperówka alumin podwójna
676,15253,torebka pap 
677,15254,torebka pap 
678,15255,torebka pap 
679,10457,sp torba rodzinna papierowa
680,10923,widokówka osie tleń szt
681,14229,zemar cerkiel szt
682,14230,zemar ołówek excellent szt
683,15132,wstążka juta nadruk m
684,15133,wstążka z siatki koronkowej m
685,15134,grafit do cyrkla grand
686,3980,pędzelek szkolny pe h
687,14060,serwetki wycinane mix
688,9867,balon
689,17093,cyrkiel na ołówek
690,5063,reklamówka mikr
691,5454,kosz na zakupy
692,6432,my office kieszeń a
693,11335,koperta biała a 
694,11345,okładka na zeszyt
695,11792,kartka imieninowa
696,17072,koperta biała a
697,66,sklep polski torba zrywka 
698,14064,torba eko wzor
699,14854,zemar pędzle szkolne szt
700,14855,zemar pędzle szt
701,14870,zemar naklejka na zeszyt zwykła
702,1001575,okładka na zeszyt a a 
703,1081,gumka do mazania mf
704,8011,plan lekcji bambimo
705,10463,długopis nożyczki
706,10503,temperówka metal
707,10464,długopis czerw bp
708,11267,długopis kompl
709,3865,koperta szt
710,11234,balon
711,11337,papier kancelaryjny linie
712,15220,koperty mini
713,18499,herbata z automatu
714,149,sklep polski torba zrywka 
715,11728,słoik l
716,14083,sloik l
717,14084,sloik l
718,14085,sloik l
719,14087,sloik to 
720,14088,sloik to 
721,14089,sloik l
722,14179,sloik l
723,14181,sloik l
724,14191,butla do wina w koszu l
725,15256,ags przykrywka szklana wecka
726,11147,wazon
727,13064,zestaw obiadowy
728,5294,agc tortownica szklana obrotowa aneks
729,14902,słoik l szt
730,14907,słoik to cedrus szt
731,15065,słoik ml
732,15066,słoik l
733,17073,słoik l
734,17074,słoik l
735,17075,słoik l
736,21749,zemar kieliszki ml pakowane po szt
737,17025,kieliszek do wódki szt
