,code,product_name
4027,7411,swojski stragan szynka rolka kg 
4028,7414,jbb wieprzowina z ogórkiem kg 
4029,7415,pekpol pasztet kurpiowskie specjały kg 
4030,7417,sobieraj swojska kg 
4031,7418,pekpol kiełbasa bukowa kg 
4032,7419,różyccy salceson ozorowy kg 
4033,7420,pekpol kiełbasa śląska extra kg 
4034,7423,prosiaczek salceson czarny kg 
4035,7426,peklimar polędwica sopocka wieprzowa kg 
4036,7427,peklimar polędwica zapiekana rzeźnik kg 
4037,7428,giżewski kabanos z filetem z indyka kg 
4038,7429,giżewski szynka z indykiem kg 
4039,7430,prosiaczek szynka słoneczna kg 
4040,7431,prosiaczek szynka wieprzowa w galarecie kg 
4041,7432,prosiaczek westwalska szynka z tłuszczem kg 
4042,7436,skiba smaczek konserwowy kg 
4043,7441,sokołów gold kabanosy luksusowe kg 
4044,7442,sokołów jubilatki kg 
4045,7443,sokołów kiełbasa krajana kg 
4046,7444,sokołów kiełbasa sokołowska wieprzowa kg 
4047,7446,sokołów łopatka z weka kg 
4048,7447,sokołów metka łososiowa kg 
4049,7448,sokołów mortadela codzienna kg 
4050,7449,sokołów mortadela wieprzowa kg 
4051,7450,sokołów nasz salceson kg 
4052,7451,sobieraj kiełbaski krzeszyckie kg 
4053,7453,sokołów pasztetowa firmowa kg 
4054,7454,sokołów salami wielkopolskie kg 
4055,7455,sokołów smaczek w konserwie kg 
4056,7456,sokołów sokoliki kg 
4057,7457,sokołów szynka chlebowa kg 
4058,7458,sokołów szynka włoska kg 
4059,7459,sokołów szynka z rozmarynem kg 
4060,7460,sokołów kiełbasa tyrolska kg 
4061,7462,matias kg 
4062,7463,stokłosa boczek parzony kg 
4063,7464,różyccy kaszanka kg 
4064,7465,różyccy karkówka dojrzewająca kg 
4065,7467,łuków kiełbasa familijna kg 
4066,7468,elpozo chorizo doux kg 
4067,7469,jbb filusie kg 
4068,7471,swojski stragan krakowska podsuszana map kg 
4069,7472,swojski stragan pieczeń myśliwska kg 
4070,7473,swojski stragan karczek z prodiża kg 
4071,7474,swojski stragan polędwica sopocka kg 
4072,7475,swojski stragan przysmak wieprzowy z ogórkiem kg 
4073,7476,stół polski salceson królewski kg 
4074,7478,pruszcz szynka dziadka kg 
4075,7479,prosiaczek kiełbasa surowa biała dziadkowa z metra kg 
4076,7480,rogowo kiełbasa madrycka kg 
4077,7481,korona kiełbasa toruńska kg 
4078,7483,polonus kiełbasa z fileta kg 
4079,7484,polonus pieczeń ze śliwką kg 
4080,7487,prosiaczek kiełbasa surowa metka wędzona kg 
4081,7489,nik pol boczek chłopski wędzony kg 
4082,7490,kier polędwiczka z warzywami kg 
4083,7491,nik pol baleron regionalny kg 
4084,7492,anmiex wędzonka krotoszyńska kg 
4085,7494,madej wróbel kiełbasa toruńska regionalna kg 
4086,7498,pruszcz pasztetowa swojska kg 
4087,7499,tarczyński kiełbasa biała parzona kg 
4088,7500,tarczyński szynka chlebowa kg 
4089,7501,haga schab pieczony kg 
4090,7502,tarczyński szynka z kotła kg 
4091,7506,viando kiełbasa krucha kg 
4092,7507,viando kiełbasa polska pieczona kg 
4093,7508,viando kiełbasa polska wędzona kg 
4094,7509,viando kiełbasa krakowska sucha extra kg 
4095,7510,viando parówki z cielęciną kg 
4096,7511,viando pasztetowa wędzona j nat kg 
4097,7512,viando podroby gotowane kg 
4098,7517,chabura golonko w konserwie kg 
4099,7525,kozłowski kiełbasa toruńska pieczona kg 
4100,7528,kubiak ser twarogowy domowy kg 
4101,7529,wędliny plastry 
4102,7531,lukullus kiełbasa śląska kg 
4103,7533,duda filet królewski z indyka kg 
4104,7534,morliny parówki morlińskie kg 
4105,7536,prosiaczek polędwica delikatna z indyka kg 
4106,7537,prosiaczek pierś z kurczaka na grila kg 
4107,7539,stół polski parówki extra kg 
4108,7540,sokołów pasztet dzidunia kg 
4109,7541,krzyś pasztet borowikowy kg 
4110,7542,sokołów wędzonka z podlaskiej wędzarni kg 
4111,7545,mielczarek kiełbasa zwyczajna kg 
4112,7546,sokołów szynka z piersią indyka kg 
4113,7548,bystry schab staropolski kg 
4114,7550,sokołów pieczeń chlebowa kg 
4115,7552,sokołów kurczak po królewsku kg 
4116,7553,sokołów boczek rolowany kg 
4117,7556,krakus schab od krakusa kg 
4118,7559,sokołów parówki basiuni kg 
4119,7560,cedrob polędwica z piersi kurczaka kg 
4120,7561,sokołów parówki z szynki kg 
4121,7562,chmarzyński kaszanka cienka kg 
4122,7564,cedrob pierś wędzona kg 
4123,7565,ceko ser boryna kg 
4124,7566,ceko ser jagna kg 
4125,7567,ceko ser wiedeński mały kg 
4126,7574,lazur ser pleśniowy błękitny główka kg 
4127,7576,mlekpol ser havarti kg 
4128,7580,animex kiełbasa żywiecka skos kg 
4129,7581,mońki ser morski pełnotłusty kg 
4130,7582,mońki ser nadbiebrzański pełnotłusty kg 
4131,7585,president ser ementalski blok kg 
4132,7588,ryki ser wędzony ramzes kg 
4133,7590,sierpc ser królewski wędzony blok kg 
4134,7593,włocławek twaróg śmietankowy kg 
4135,7597,włoszczowa ser morski kg 
4136,7602,jana twaróg wędzony próżniowy czosn papr kg 
4137,7605,mona twaróg luks krąg mały kg 
4138,7606,osm śrem ser salami blok kg 
4139,9390,mońki ser edamski pełnotłusty kg 
4140,7609,strzałkowo twaróg półtłusty krajanka kg 
4141,7610,osm śrem ser gouda mini kg 
4142,7612,łowicz ser salami kg 
4143,7615,prosiaczek dziadkowa kaszanka kg 
4144,7616,pietrak bigos myśliwski kg 
4145,7617,łukosz szynka biała drobiowa kg 
4146,7618,miłosław metka cebulowa kg 
4147,7619,ryki ser maasdam rycki kg 
4148,7623,koło ser twarogowy grodk pełnotłuste klinek kg 
4149,7626,kabanos schab cygański kg 
4150,7628,swojski stragan polędwica wiśniowa kg 
4151,7629,cedrob medalion z serem panierowany smażony kg 
4152,7630,ceko ser mozzarella kg 
4153,7631,cedrob kurczak gotowany z kurnej półki kg 
4154,7632,sokołów frankfurterki kg 
4155,7636,sokołów kanapkowa po góralsku kg 
4156,7640,balcerzak żywiecka extra kg 
4157,7641,morliny szynka konserwowa blok kg 
4158,7642,bąkowski serduszko deserowe szt 
4159,7643,madej wróbel szynka z beczki kg 
4160,7650,bell salami hiszpańskie z oliwkami kg 
4161,7652,grzegorzew kiełbasa szynkowa kg 
4162,7654,jbb salceson sułtański kg 
4163,7656,sokołów schab z weka kg 
4164,7657,chmarzyński krakowska sucha extra kg 
4165,7658,krakus ełk szynka od szwagra kg 
4166,7660,sokołów szynka świąteczna kg 
4167,7661,chmarzyński biała cienka surowa kg 
4168,7663,mielczarek frankfurterki kg 
4169,7664,giżewski mortadela codzienna kg 
4170,7665,giżewski polędwica chlebowa kg 
4171,7666,giżewski szynkowa z indyka kg 
4172,7667,morszczuk filet z s kg 
4173,7668,giżewski salceson firmowy kg 
4174,7669,giżewski salami firmowe kg 
4175,7671,giżewski szynkowa z filetem kg 
4176,7672,obórka boczek parzony kg 
4177,7673,giżewski szynka z beczki kg 
4178,7674,łuków boczek w marynacie tacka kg 
4179,7678,jbb parówki tęczowe kg 
4180,7679,abc zestaw zakąsek nr 
4181,7680,miłosław pasztet borowikowy kg 
4182,7682,cedrob medalion z pieczarkami panierowany smażone kg 
4183,7684,jbb kurczak w galarecie kg 
4184,7685,jbb pasztet masarza kg 
4185,7686,jbb szynka z piersi indyka kg 
4186,7687,paszak kiełbasa biała parzona kg 
4187,7688,paszak kiełbasa bacówka kg 
4188,7689,sokołów salami bumerang kg 
4189,7690,chmarzyński szlachetna z pieprzem kg 
4190,7691,paszak kaszanka biała kg 
4191,7692,paszak kiełbasa kanapkowa kg 
4192,7693,paszak luncheon kg 
4193,7694,kaminiarz boczek parzony paski kg 
4194,7695,grzegorzew kiełbasa krakowska kg 
4195,7697,paszak kiełbasa zwyczajna kg 
4196,7698,sokołów kiełbasa wielkanocna kg 
4197,7700,spomlek serenada ser radamer blok kg 
4198,7701,tarczyński kiełbasa śląska kg 
4199,7702,kaminiarz boczek parzony z s vac kg 
4200,7704,indykpol smakołyk puchatka z indyka kg 
4201,7705,jbb golonka extra w konserwie masr u józefa kg 
4202,7706,jbb pasztet z pieca drobiowo wieprzowy kg 
4203,7708,paszak pieczeń rzymska kg 
4204,7711,bystry metka łososiowa kg 
4205,7712,balcerzak zapiekaniec tatrzański kg 
4206,7713,duda mortadela firmowa kg 
4207,7715,sokołów kiełbasa spod strzechy kg 
4208,7716,dworecki kiełbasa golonkowa kg 
4209,7717,michorzewko kiełbasa jałowcowa kg 
4210,7718,frąckowiak ser smażony z kminkiem kg 
4211,7720,swojski stragan kiełbasa cygańska kg 
4212,7721,dworecki kiełbasa jałowcowa kg 
4213,7722,niewieścin karkówka długodojrzewająca kg 
4214,7725,sami swoi smaczek konserwowy kg 
4215,7728,mońki ser aldamer pełnotłusty kg 
4216,7730,balcerzak szynka gotowana kg 
4217,7732,mięso ii gatunek kg 
4218,7733,bystry polędwica sopocka kg 
4219,7734,księży młyn schab polski kg 
4220,7735,obórka metka łosoś kg 
4221,7738,grzegorzew salceson wiejski kg 
4222,7739,księży młyn baleron kg 
4223,7742,księży młyn zawijaniec boczkowy kg 
4224,7743,księży młyn zawijaniec po cygańsku kg 
4225,7744,frątczak parówka delikatesowa kg 
4226,7746,giżewski piwoszki extra kg 
4227,7747,giżewski szynka z koperkiem mielona kg 
4228,7748,szajek piwoszki kg 
4229,7749,jbb konserwowa wieprzowa kg 
4230,7750,paszak kiełbasa wawelska kg 
4231,7752,księży młyn szynka polska kg 
4232,7756,księży młyn kaszanka gruba kg 
4233,7759,drobex pasztetowa wędzona kg 
4234,7760,księży młyn mortadela wędzona kg 
4235,7762,kier schab dojrzewający kg 
4236,7764,peklimar krotoszyńska wędzona surowa kg 
4237,7766,jbb kiełbasa swojska z cielęciną kg 
4238,7767,sokołów szynka dziadkowa kg 
4239,7768,peklimar wędzonka krotoszyńska kg 
4240,7769,peklimar metka wianki kg 
4241,7770,księży młyn ogonówka kg 
4242,7771,peklimar boczek faszerowany zapiekany kg 
4243,7772,pruszcz szynka z liściem kg 
4244,7773,jbb szynka biebrzówka kg 
4245,7776,nik pol wieprzowina z pieca kg 
4246,7777,jbb kiełbasa żywiecka podsuszana kg 
4247,7781,jbb szynka z beczki kg 
4248,7784,gzella metka luksusowa kg 
4249,7786,jbb kiełbasa z karkówką kg 
4250,7787,jbb baleron kg 
4251,7790,miłosław kiełbasa polska pieczona kg 
4252,7791,chmarzyński pasztet z filetem i pi kg 
4253,7794,stół polski boczek wędzony kg 
4254,7795,jbb kiełbasa z serem kg 
4255,7797,grzegorzew kiełbasa krucha kg 
4256,7798,aleksandria schab z beczki kg 
4257,7799,sokołów kiełbasa weselna kg 
4258,7800,dworecki parówki juniorki kg 
4259,7801,miłosław kiełbasa śląska kg 
4260,7802,grzegorzew pieczeń rzymska kg 
4261,7803,gzella salami rogal reifhem kg 
4262,7804,aleksandria szynka królewska kg 
4263,7806,krzyś salceson czosnkowy kg 
4264,7807,jbb polędwica miodowa kg 
4265,7811,gzella szynka mistrza kołodzieja kg 
4266,7813,cedrob rolada z gęsi ze śliwką kg 
4267,7814,jbb kiełbasa z kija kg 
4268,7815,gzella salami z parmezanem reifhem kg 
4269,7816,peklimar pasztet z żurawiną kg 
4270,7817,masarnia krajenka kiełbasa zbójnicka kg 
4271,7820,gzella salami z posyp pomidorową reifhem kg 
4272,7823,grzegorzew salceson ozorkowy kg 
4273,7828,smoliński pieczeń delikatesowa kg 
4274,7829,sokołów pasztetowa drobiowa z wieprzowiną kg 
4275,7830,sokołów polędwica śniadaniowa kg 
4276,7832,jbb schab z beczki kg 
4277,7833,indykpol pasztet ze śliwkami kg 
4278,7834,lukullus szynka konserwowa kg 
4279,7835,jbb polędwica sopocka regionalna kg 
4280,7836,paszak podgardle wędzone parzone kg 
4281,7837,krzyś kaszanka gruba kg 
4282,7840,gzella salami drobny pieprz kg 
4283,7842,jbb filet indykiem faszerowany kg 
4284,7843,sława kiełbasa golonkowa kg 
4285,7847,sokołów kiełbasa biała parzona kg 
4286,7848,chmarzyński pasztetowa z osia kg 
4287,7851,bomax drożdżówka z budyniem szt 
4288,7852,sokołów kiełbasa grilowa złota kg 
4289,7853,madej wróbel kiełbasa krucha z galaretką kg 
4290,7854,lukullus szynka tradycyjna kg 
4291,7856,kier karczek z komina kg 
4292,7857,księży młyn zrazówka kasztelańska kg 
4293,7859,prosiaczek pasztet z dziadkową szynką kg 
4294,7860,gzella salami z posypką paprykową kg 
4295,7862,sokołów boczek paski parzony kg 
4296,7867,balcerzak kiełbasa tatrzańska kg 
4297,7870,sokołów kiełbasa kolska kg 
4298,7878,dworecki serdelka delikatesowa kg 
4299,7879,balcerzak szynka drewnem wędzona kg 
4300,7884,księży młyn szynkówka kg 
4301,7885,sm drzycim ser morski kg 
4302,7886,giżewski indyczka gotowana kg 
4303,7887,giżewski przekładaniec z indykiem kg 
4304,7889,giżewski szynka konserwowa lux z indyka kg 
4305,7891,giżewski krakowska z fileta kg 
4306,7893,koma boczek wędzony kg 
4307,7896,kwiecińscy róg obfitości kg 
4308,7900,jbb schab benedykta po żydowsku kg 
4309,7903,giżewski baton z przyprawami kg 
4310,7905,jbb dębicka z zielonym pieprzem kg 
4311,7906,księży młyn pieczeń kasztelańska kg 
4312,7907,pamso kurczak z warzywami kg 
4313,7908,tarczyński kabanos klasyczny drobiowy kg 
4314,7909,tarczyński kabanos klasyczny wieprzowy kg 
4315,7910,swojski stragan kiełbasa biała parzona kg 
4316,7916,ceko ser dobrodziej kg 
4317,7920,grant kiełbasa suszona z poddasza kg 
4318,7922,jbb sołtysówka kg 
4319,7925,kier kabanosy wieprzowe kg 
4320,7926,kier kiełbasa dojrzewająca z orzechami kg 
4321,7927,mielczarek kiełbasa biała surowa polska kg 
4322,7928,gaik boczek zbójnicki paski kg 
4323,7929,księży młyn kiełbasa szynkowa z pieprzem kg 
4324,7937,monika ciastka szyszka przekładana kg 
4325,7938,swojski stragan szynka w kotle gotowana kg 
4326,7939,taurus kornetki kg 
4327,7940,prosiaczek kiełbasa dziadkowa kg 
4328,7941,jbb szynka biała królewska kg 
4329,7942,jbb szynka gotowana kg 
4330,7944,stokłosa szynkowa kanapkowa kg 
4331,7945,stokłosa frankfurterki kg 
4332,7947,spomlek serenada ser królewiecki szwajcar blok kg 
4333,7949,masarnia krajenka szynka jak dawniej ciepła kg 
4334,7950,miłosław smalec babuni szt 
4335,7957,grzegorzew polędwica sopocka kg 
4336,7959,sokołów nasza szynka kg 
4337,7960,ael szynka od szwagra kg 
4338,7963,konecke salami texas kg 
4339,7968,księży młyn szynka od gospodarza kg 
4340,7969,paszak salceson folia kg 
4341,7971,chmarzyński salceson ozorowy kg 
4342,7972,nowak szynka delikatna z fileta kg 
4343,7973,jbb kiełbasa łysecka z szynką kg 
4344,7974,księży młyn schabowa spod strzechy wędzarza kg 
4345,7975,dworecki rolada drob z serem szpinakiem kg 
4346,7976,nowak kiełbasa śląska kg 
4347,7979,giżewski filet biały kg 
4348,7980,giżewski filet z kotła kg 
4349,7981,giżewski filet pieczony kg 
4350,7982,sokołów kiełbaski polskie surowe kg 
4351,7984,mlekpol ser rolada ustrzycka kg 
4352,7985,mróz szyneczka świąteczna kg 
4353,7986,stół polski boczek parzony paski kg 
4354,7987,bell salami musli kg 
4355,7991,mniaam mniaam sałatka jarzynowa kg 
4356,7992,lukullus szynka drewnem wędzona kg 
4357,7996,aleksandria metka łososiowa kg 
4358,7997,sokołów smalec wyborowy extra kg 
4359,7998,pyzy z mięsem luz 
4360,7999,kaszubskie rolmopsy kg 
4361,8001,kartacze kg 
4362,8002,sokołów nasz baleron kg 
4363,8006,sokołów szynka klasyczna sokołowska kg 
4364,8007,duda szynka farmerska kg 
4365,8010,jbb szynka alpejska kg 
4366,8012,stół polski ogonówka parzona kg 
4367,8013,bystry karkówka staropolska kg 
4368,8015,stokłosa kiełbasa zwyczajna kg 
4369,8016,stokłosa parówkowa śniadaniowa kg 
4370,8017,stokłosa polędwica senatorska kg 
4371,8020,stokłosa kaszanka jęczmienna kg 
4372,8023,ozimek kiełbasa piwna kg 
4373,8024,ozimek kiełbasa dobrej roboty kg 
4374,8025,olewnik szynka z wędzarni kg 
4375,8028,krakus szynka od krakusa kg 
4376,8029,sokołów szynka z podlaskiej wędzarni kg 
4377,8030,giżewski filet gotowany z kurczaka kg 
4378,8031,jbb kiełbasa cygańska kg 
4379,8032,łuków boczek rolowany z czosnkiem kg 
4380,8033,morliny kiełbasa morlińska z piersi kurczaka kg 
4381,8035,jbb szynka soczysta z beczki kg 
4382,8037,łuków polędwica surowa wędzona kg 
4383,8039,stokłosa kiełbasa biała surowa kg 
4384,8040,stokłosa kiełbasa bydgoska kg 
4385,8042,księży młyn schab kasztelański kg 
4386,8046,morliny kiełbasa śląska kg 
4387,8047,jbb kaziuk kg 
4388,8048,nik pol kiełbasa cygańska kg 
4389,8050,prosiaczek szynka dziadkowa mini kg 
4390,8051,jbb szynka konserwowa wieprzowa kg 
4391,8052,stokłosa przysmak konserwowy kg 
4392,8053,sokołów szynka sołtysa kg 
4393,8055,śmiłowo szynka wieprzowa firmowa kg 
4394,8056,stokłosa smalec osłonka kg 
4395,8059,giżewski kiełbasa krakowska sucha z indyka kg 
4396,8063,stokłosa schab w przyprawach kg 
4397,8064,księży młyn blok szynkowy kg 
4398,8065,księży młyn schab od gospodarza kg 
4399,8066,miłosław metka łososiowa kg 
4400,8068,cedrob medaliony ze szpinakiem i serem kg 
4401,8071,smoliński salami kg 
4402,8072,księży młyn szynka wędzona z ksieżego młyna kg 
4403,8073,księży młyn szynka z księżego młyna kg 
4404,8076,jbb polędwica anny kg 
4405,8077,sokołów pasztecik firmowy kg 
4406,8078,jbb zawijaniec kg 
4407,8080,chmarzyński salceson czarny kg 
4408,8082,stokłosa kiełbasa z wołowiną kg 
4409,8084,masarnia krajenka schab drewnem wędzony kg 
4410,8085,grzegorzew mortadela kg 
4411,8086,jbb szynka sołtysówka kg 
4412,8087,tarczyński królewska mielona szynka kg 
4413,8089,michowianka ser hipokryta kg 
4414,8090,mróz szynka polska kg 
4415,8095,bystry szynka rodzinna kg 
4416,8097,staropolskie wędliny polędwica drobiowa z majerankiem kg 
4417,8100,grzegorzew pieczeń drobiowa kg 
4418,8102,chmarzyński kiełbasa górska kg 
4419,8104,łuków kiełbasa z serem kg 
4420,8106,sokołów schab sołtysa kg 
4421,8107,madej wróbel golonko w galarecie kg 
4422,8110,krzyś salceson łęczycki premium kg 
4423,8111,krzyś kaszanka prowansalska kg 
4424,8115,miłosław kiełbasa słoikowa kg 
4425,8123,dworecki boczek surowy wędzony kg 
4426,8125,nowak boczek parzony paski kg 
4427,8127,miłosław kiełbasa ze świniobicia wędzona kg 
4428,8129,księży młyn szynka szlachecka kg 
4429,8130,mróz szynka okopcona kg 
4430,8131,jbb kiełbasa z piersi kurczaka kg 
4431,8132,morliny kiełbasa morlińska z szynki kg 
4432,8133,spomlek serenada ser salami pieprz i papryka kg 
4433,8135,pekpol paryżanki kg 
4434,8139,sokołów schab pieczony narurrino kg 
4435,8144,jbb salceson bawarski kg 
4436,8145,sokołów serdelki z szynki kg 
4437,8146,miłosław kaszanka cienka kg 
4438,8148,prosiaczek kiełbasa dziadkowa góralska kg 
4439,8150,księży młyn schab spod strzechy wędzarz kg 
4440,8151,seko płat marynowany kg 
4441,8152,drobimex kiełbaski śląskie kg 
4442,8154,jbb kiełbasa swojska kg 
4443,8155,karol boczek rolowany kg 
4444,8161,bystry salami czoskowe kg 
4445,8165,morliny szynka biała królewska kg 
4446,8166,bell salami z zielonym pieprzem kg 
4447,8168,jbb schab biały kg 
4448,8169,dobra marka kiełbasa parówkowa kg 
4449,8171,jbb szynka z kotła kg 
4450,8176,łowicz ser gouda blok kg 
4451,8177,grzegorzew ogonówka kg 
4452,8179,balcerzak salceson wieprzowy kg 
4453,8181,kier kiełbasa bukowa kg 
4454,8183,kier baleron gotowany kg 
4455,8184,kier kiełbasa chłopska kg 
4456,8186,księży młyn kiełbasa toruńska z wołowiną extra kg 
4457,8187,kabanos szynka wójta kg 
4458,8188,kier salceson królewski kg 
4459,8189,kier smalec smarowny kg 
4460,8190,kier rolada schabowa kg 
4461,8191,kier mielonka królewiecka kg 
4462,8193,ceko ser antek kg 
4463,8194,kier pasztet z cebulką kg 
4464,8196,duda salceson polski kg 
4465,8197,kier kaszanka chłopska kg 
4466,8198,kier schab sopocki kg 
4467,8199,kier pasztetowa wędzona kg 
4468,8201,ciepłuch szynka babuni kg 
4469,8203,kier kiełbasa biała extra kg 
4470,8208,kier szynka szlachecka borowiaka kg 
4471,8210,jbb szynka z pieca kg 
4472,8211,rogowo pasztetowa delikatny smak kg 
4473,8219,kier kiełbasa krakowska parzona kg 
4474,8220,kier kiełbasa szynkowa z indyka kg 
4475,8221,kier kiełbasa żywiecka firmowa kg 
4476,8223,viando parówkowa z kujaw kg 
4477,8224,madej wróbel szynka konserwowa kg 
4478,8225,kier franki wędzone kg 
4479,8226,kier kiełbasa polska pieczona kg 
4480,8227,kier szynka chlebowa kg 
4481,8230,jbb kiełbasa złota grillowa kg 
4482,8232,kier szynkóweczka kg 
4483,8234,nowak szynka gdańska wędzona kg 
4484,8235,sława baleron z indyka kg 
4485,8240,smoliński paluszki cienkie kg 
4486,8241,kier szynka tucholska kg 
4487,8242,duda kiełbasa ogniskowa kg 
4488,8246,nowak kiełbasa krakowska szlachecka kg 
4489,8247,kier parówki z cielęcny kg 
4490,8248,kier szynka biesiadna kg 
4491,8249,mielczarek kiełbasa słoikowa kg 
4492,8250,smoliński karkówka z pieca kg 
4493,8254,jbb szynka na krajalnicę kg 
4494,8256,kier boczek duński kg 
4495,8257,jbb parówki hot dog kg 
4496,8258,madej wróbel kiełbasa piwna kg 
4497,8259,rogowo polędwica sopocka parzona kg 
4498,8264,prosiaczek szynka drobiowa w galarcie kg 
4499,8266,balcerzak kindziuk kg 
4500,8268,madej wróbel kiełbasa wieprzowa z cieleciną kg 
4501,8270,madej wróbel szynka bukowa kg 
4502,8272,sława szynka peerelowska kg 
4503,8277,biegun szynka gotowana c kg 
4504,8278,biegun kiełbasa polska kg 
4505,8279,biegun szynka szlachecka kg 
4506,8280,biegun szynka surowa wędzona kg 
4507,8281,biegun schab pieczony kg 
4508,8283,stokłosa salceson wielkopolski kg 
4509,8285,jbb kiełbasa ze wsi kg 
4510,8286,gaik kiełbasa myśliwska sucha kg 
4511,8289,gaik kiełbasa jałowcowa kg 
4512,8290,smoliński kiełbasa gospodarza firmy kg 
4513,8291,sokołów pasztet z wątróbka kg 
4514,8292,biegun szynka szlachecka c kg 
4515,8293,biegun wieprzowina pieczona c kg 
4516,8294,biegun kiełbasa ręcznie wyrabiana na ciepło kg 
4517,8296,kier kiełbasa z piersi kurczaka kg 
4518,8297,prosiaczek biała dziadkowa parzona kg 
4519,8298,morliny polędwica sopocka kg 
4520,8299,tarczyński parówki z szynki kg 
4521,8301,czyżew tyrolska kg 
4522,8303,tarczyński parówki z fileta kg 
4523,8304,stokłosa kiełbasa jałowcowa pikantna kg 
4524,8305,biegun kiełbasa słowiańska kg 
4525,8306,stokłosa kiełbasa polska wędzona kg 
4526,8307,krakus szynka zrazowa kg 
4527,8308,krakus schab od szwagra kg 
4528,8309,łuków kiełbasa biała delikatesowa z ziołami kg 
4529,8311,kier kiełbasa szlachecka borowiaka kg 
4530,8312,kabanos pasztet z indyka pieczony kg 
4531,8314,obórka metka cebulowa kg 
4532,8315,kier pasztetowa pomidorowa kg 
4533,8317,bell carpaccio wieprzowe kg 
4534,8318,biegun kiełbasa z serem kg 
4535,8319,sokołów kiełbasa toruńska kg 
4536,8320,kier kiszka ziemniaczana kg 
4537,8324,kabanos kiełbasa cygańska kg 
4538,8325,łuków kaszanka biała delikatesowa kg 
4539,8326,sami swoi szynkówka kg 
4540,8328,frątczak szynka delikatesowa kg 
4541,8329,bratek bułka morska g 
4542,8330,kier rolada z polędwiczką kg 
4543,8334,prosiaczek rogal dobrodzieja kg 
4544,8336,biegun wędzonka szefa wędzonka chłopska kg 
4545,8337,tarczyński regionalna mielonka kg 
4546,8338,biegun wątrobianka kg 
4547,8340,tarczyński indyk biały z kotła kg 
4548,8341,morliny kiełbasa morlińska kg 
4549,8342,lukullus konserwa wojskowa kg
4550,8343,monika ciastka muszelki kg 
4551,8344,sokołów kiełbasa wędzona z galaretką kg 
4552,8345,swojski stragan salceson królewski kg 
4553,8346,abc sałatka jarzynowa g 
4554,8349,stokłosa boczek rolowany kg 
4555,8354,bystry kiełbasa myśliwska kg 
4556,8361,bystry kabanosy kg 
4557,8365,peklimar kiełbasa krakowska z fileta kg 
4558,8368,jbb kiełbasa złota grilowa kg 
4559,8370,stokłosa szynka biała extra kg 
4560,8371,stokłosa szynka dobra kg 
4561,8374,sokołów parówki delikatne kg 
4562,8376,ser figaro kg 
4563,8377,biegun kabanosy z cielęciną kg 
4564,8379,jbb kiełbasa podwawelska kg 
4565,8381,skiba poledwica sopocka kg 
4566,8384,frątczak kiełbasa polska kg 
4567,9393,gaik kiełbasa dymiona kg 
4568,8394,księży młyn kiełbasa szynkowa wędzona kg 
4569,8395,arla port salut kg 
4570,8396,księży młyn wędzonka od gospodarza kg 
4571,8397,swojski stragan salceson luksusowy kg 
4572,8398,kabanos mielonka familijna kg 
4573,8399,franka rolady tradycyjne kg 
4574,8400,stokłosa wędzonka krotoszyńska kg 
4575,8401,prosiaczek dziadkowa szynkowa kg 
4576,8403,prosiaczek polędwica delikatna z kurcząt kg 
4577,8404,prosiaczek kiełbasa bydgoska kg 
4578,8407,biegun szynka kowala kg 
4579,8409,stokłosa mortadela kg 
4580,8410,łuków szynka gosposi kg 
4581,8411,stokłosa wędzonka gospodarza kg 
4582,8415,czyżew mortadela codzienna kg 
4583,8416,kier boczek chłopski kg 
4584,8417,sokołów delikatesowa z warzywami kg 
4585,8421,aleksandria szynkowa z pieprzem kg 
4586,8423,prosiaczek szynka dobrodzieja kg 
4587,8424,aleksandria mortadela aleksandryjska kg 
4588,8426,prosiaczek szynka dziadkowa kg 
4589,8428,swojski stragan kaszanka cienka kg 
4590,8429,franka kiełbasa biała kg 
4591,8430,swojski stragan kiełbasa śląska złota kg 
4592,8433,prosiaczek krucha dobrodzieja kg 
4593,8435,czyżew pasztet dziadunia kg 
4594,8436,duda krakowska parzona kg 
4595,8437,duda lunchmeat królewski kg 
4596,8438,lukullus parówki z cielęciną kg 
4597,8441,duda szynka weselna kg 
4598,8442,aleksandria szynka z pieca kg 
4599,8443,aleksandria smaczek konserwowy kg 
4600,8445,kier krakowska drobiowa podsuszana kg 
4601,8446,stokłosa wędzonka z łopatki kg 
4602,8447,stokłosa polędwica z wędzarni kg 
4603,8448,stokłosa szynka pieczona z wędzarni kg 
4604,8449,rogowo kiełbasa bydgoska kg 
4605,8451,rogowo kiełbasa biała kg 
4606,8453,rogowo kaszanka kg 
4607,8455,rogowo kiełbasa parówka kg 
4608,8456,rogowo salceson czarny kg 
4609,8457,rogowo kiełbasa krucha kg 
4610,8459,rogowo kiełbasa ze wsi kg 
4611,8462,kaminiarz boczek wędzony paski vac kg 
4612,8463,smoliński pasztet ardeński kg 
4613,8466,smoliński salceson włoski kg 
4614,8467,prosiaczek łososiówka na pieprzu kg 
4615,8468,jbb kiełbasa krótka gospodarska kg 
4616,8471,marciniszyn salceson z indyka kg 
4617,8473,tarczyński kiełbasa geesowska kg 
4618,8474,kabanos pasztet szefa kg 
4619,8475,kier parówki pomorskie kg 
4620,8477,stokłosa frankfurterki śmiałowo kg 
4621,8478,stokłosa kiełbasa krucha kg 
4622,8481,biegun kiełbasa żywiecka kg 
4623,8483,biegun szynka konserwowa prasowana kg 
