,code,product_name
7663,13100,słodkie niebo ciasto makowiec kg 
7664,13101,słodkie niebo ciasto leśny mech kg 
7665,13102,słodkie niebo ciasto góra lodowa kg 
7666,13103,słodkie niebo ciasto metrowiec kg 
7667,13104,kuczora ciasto pijak kg 
7668,13105,kuczora ciasto samanta kg 
7669,13106,kuczora ciasto kokosowy raj kg 
7670,13112,sława sułocha kiełbasa krucha kg 
7671,13115,sława sułocha kiełbasa krakowska sucha kg 
7672,13118,sława sułocha polędwiczki surowe wędzone kg 
7673,13126,elio chleb na naturalnym zakwasie szt 
7674,13128,dworecki rożek drobiowy kg 
7675,13129,ocean filet tilapia b s g 
7676,13130,gaik szynka wiejska kg 
7677,13131,chabura schab rzeźnika kg 
7678,13132,polskie pszysmaki schab z gór kg 
7679,13133,unimięs szynka krucha z chrzanowa kg 
7680,13134,balcerzak szynka wędzona po cieszyńsku kg 
7681,13135,madej wróbel kiełbasa żywiecka kg 
7682,13136,słodkie niebo ciasto sernik na zimno kg 
7683,13137,rzepa biała kg 
7684,13138,masarnia krajenka kiełbasa wiejska ze słoika g 
7685,13141,chrupek rogal świąteczny kg 
7686,13142,trojanka eklerki ptysie kg 
7687,13143,jagódka pączek z czekoladą szt 
7688,13144,piekuś kostka malibu kg 
7689,13145,piekuś rolada mango marakuja kg 
7690,13146,gs nowe sernik kg 
7691,13148,tosta paluchy francuskie kg 
7692,13149,biernacki sałatka jarzynowa kg 
7693,13150,biernacki sałatka z kurczakiem kg 
7694,13151,cf ciasto murzynek z czekoladą kg 
7695,13163,słodkie niebo ciasto kinder maxi king kg 
7696,13164,olsza szarlotka z orzechami kg 
7697,13165,olsza sernik truskawkowy ananasowy kg 
7698,13166,olsza porzeczka na czarno kg 
7699,13167,olsza ciasto pani walewska kg 
7700,13168,staropolskie wędliny kurczak w galarecie kg 
7701,13169,staropolskie wędliny metka wianki kg 
7702,13170,wawrów bułka maślana szt 
7703,13172,olek ciasto drożdżowe kg 
7704,13173,olek babka kg 
7705,13174,olek tort kg 
7706,13175,olek ciastka bitki kg 
7707,13176,olek ciastka kruche z wiśnią kg 
7708,13177,olek ciastka karbowane kg 
7709,13179,olek rogaliki półfracuskie kg 
7710,13185,olek muffiny z nadzieniem czekolada szt 
7711,13191,olek bajaderka szt 
7712,13192,olek beza pavlowa szt 
7713,13196,fałkowo chleb z burakiem szt 
7714,13197,gs wijewo rogale z masą makową kg 
7715,13199,łabiszyn wianuszek szt 
7716,13203,łabiszyn pączek trójkątny z jabłkiem szt 
7717,13204,łabiszyn omlet z kremem g 
7718,13205,łabiszyn ekler g 
7719,13206,łabiszyn rurka z kremem g 
7720,13208,łabiszyn ptyś z kremem g 
7721,13209,kilian kostka tiramisu kg 
7722,13210,kier karkówka pieczona kg 
7723,13211,chrupek chleb okolicznościowy szt 
7724,13212,słodkie niebo ciasto marchewkowe kg 
7725,13214,wędliny od zawsze boczek rolowany kg 
7726,13215,sława osełka z indyka kg 
7727,13221,łabiszyn bułka maślana szt 
7728,13222,łabiszyn babka z metra kg 
7729,13224,łabiszyn ciastka kruche kg 
7730,13226,łabiszyn ciastka kruche muszelka z marmoladą kg 
7731,13231,sendal kostka cappucino kg 
7732,13234,seko panierki figurki dorszowe kg 
7733,13236,roma rogalik z białym makiem kg 
7734,13237,roma kostka piernikowa kg 
7735,13241,cf półksiezyc z jablkiem g 
7736,13242,swojscy konserwa wojskowa z szynki kg 
7737,13245,kuczora kostka karmelowa kg 
7738,13265,gs nowe paszteciki drożdżowe kg 
7739,13266,lewandowscy boczek pieczony kg 
7740,13267,lewandowscy boczek wędzony kg 
7741,13268,lewandowscy mielonka tyrolska kg 
7742,13269,lewandowscy kiełbasa parówkowa kg 
7743,13270,lewandowscy pieczeń kg 
7744,13271,lewandowscy schab kruchy kg 
7745,13272,lewandowscy szynka zapiekana na maśle kg 
7746,13273,lewandowscy boczek rolowany kg 
7747,13274,lewandowscy schab z weka kg 
7748,13275,lewandowscy swojskie jadło kg 
7749,13276,lewandowscy szynka wiejska kg 
7750,13277,dworecki zupa węgierska kg 
7751,13279,chabura kiełbasa dobra kg 
7752,13280,krajanka śledziowa w stylu kołobrzeskim kg 
7753,13282,łabiszyn rogal z makiem g 
7754,13283,tomice pączki mini na maślance kg 
7755,13284,lewandowscy schab boryna kg 
7756,13285,cf bagietka orkiszowa g 
7757,13286,śmiłowo kiełbaska mistrza kg 
7758,13287,markis kremówka papieska kg 
7759,13288,markis deserki bankietowe kg 
7760,13289,markis baton brownie kg 
7761,13290,lewandowscy kiełbasa surowa meksykańska kg 
7762,13291,lewandowscy metka bawarska kg 
7763,13292,lewandowscy pasztetowa kg 
7764,13293,roma rogal marcinkowski szt 
7765,13294,chrupek rogal słodki szt 
7766,13295,rosette krokiety z kapustą i pieczarkami kg 
7767,13296,krośnice rogal z makiem szt 
7768,13297,lewandowscy kiełbasa biwakowa kg 
7769,13298,lewandowscy metka łososiowa kg 
7770,13299,lewandowscy parówki z szynki kg 
7771,13300,lewandowscy polędwica wędzona kg 
7772,13301,lewandowscy pieczeń z ogórkiem kg 
7773,13302,lewandowscy szynka biała kg 
7774,13303,lewandowscy kiełbasa śniadaniowa kg 
7775,13306,lisner filet w sosie musztardowym kg 
7776,13309,anna rogal z makiem i marmoladą szt 
7777,13310,barczak rogal kg 
7778,13313,pomidor kumato kg 
7779,13315,hańderek biodrówka z piekarnika kg 
7780,13316,roma pierniczki kg 
7781,13317,sokołów połówka salami w obsypce czerwona papryka kg 
7782,13318,biegun metka kg 
7783,13319,lewandowscy kiełbasa delikatesowa kg 
7784,13320,lewandowscy kaszanka w poliam kg 
7785,13321,lewandowscy kiełbasa piwna kg 
7786,13322,lewandowscy salceson toscana kg 
7787,13323,smoliński kiełbasa bohuna kg 
7788,13324,kuczora brzdąc kg 
7789,13325,kuczora bueno kg 
7790,13326,balcerzak kiełbasa śląska firmowa kg 
7791,13328,grenadier wędzony kg 
7792,13329,gs nowe pierniczki kg 
7793,13330,piekuś ciastko korzenna delicja g 
7794,13331,sierpc ser edamski kg 
7795,13332,tosta paszteciki z farszem z kapusty kg 
7796,13334,delicja animucka ciastko szt 
7797,13335,anna ptyś szt 
7798,13336,cf mix chlebów żytnich g 
7799,13337,familijna pączek kg 
7800,13339,olsza precelki w polewie kakowej g 
7801,13342,obórka ogonówka kg 
7802,13343,roma beza kg 
7803,13344,miruna pantagońska kostka kg 
7804,13346,lisner filety śledziowe w sosie grzybowym z kurkami kg 
7805,13348,bomax piernik szt 
7806,13350,swojski stragan krokiety z kapustą i pieczarkami kg 
7807,13351,nowak szynka czeladnika kg 
7808,13352,bell szynka spod lady kg 
7809,13353,sokołów kiełbasa wędzona naturrino kg 
7810,13354,gzella boczek borowiacki kg 
7811,13355,balcerzak kiełbasa polska surowa dojrzewająca z pieprzem kg 
7812,13356,tarczyński salceson wiejski kg 
7813,13357,hańderek schab od dziedzica kg 
7814,13358,różyccy szynka pieczona kg 
7815,13359,lewandowscy metka tatarska kg 
7816,13360,lewandowscy metka cebulowa kg 
7817,13361,paszak kiełbasa klasztorna kg 
7818,13362,paszak szynka pieczona tradycyjnie kg 
7819,13365,gs wijewo piernik kg 
7820,13368,roma delicje korzenne kg 
7821,13369,mark s kiełbasa głogowska kg 
7822,13370,mark s kiełbasa czosnkowa kg 
7823,13371,mark s kiełbasa lwowska kg 
7824,13372,mark s szynkowa dziadkowa kg 
7825,13373,mark s schab z tradycyjnej wędzarni kg 
7826,13374,mark s salceson wianek kg 
7827,13375,mark s pasztetowa ze świniobicia kg 
7828,13376,mark s boczek rolowany kg 
7829,13377,mark s boczek paski kg 
7830,13378,mark s golonka polska kg 
7831,13379,mark s frankfuterki kg 
7832,13380,mark s kiełbasa śląska extra kg 
7833,13381,mark s polędwiczka surowa wędzona kg 
7834,13382,mark s szynka dziadkowa kg 
7835,13390,krośnice babka z metra piernikowa kg 
7836,13392,tomice ciastka francuskie kg 
7837,13393,chrupek kostka świąteczna w polewie kg 
7838,13394,paszak ogonówka kg 
7839,13395,paszak ogonówka sopel kg 
7840,13396,paszak baleron kg 
7841,13397,paszak smarowidło kg 
7842,13398,paszak szynka wiązana kg 
7843,13399,olsza brauni ciasto na wagę kg 
7844,13400,olsza tiramisu deser ciasto kg 
7845,13402,olsza jagodzianki mini ze śmietaną kg 
7846,13405,mandarynki mini kg 
7847,13407,roma rurki migdałowe szt 
7848,13408,piekuś mini la bella g 
7849,13409,paryż pierniki domowe g 
7850,13410,kuczora tiramisu kg 
7851,13411,mniaam mniaam krokiety z kebabem szt 
7852,13412,mniaam mniaam krokiety z kapustą pieczarkami i serem szt 
7853,13413,mniaam mniaam de volaille z masłem i pietruszką szt 
7854,13414,kilian krajanka piernikowa kg 
7855,13418,niewieścin szynka krucha premium kg 
7856,13419,niewieścin szynka pieczona kg 
7857,13420,niewieścin boczek wędzono parzony porcje kg 
7858,13421,ozimek pieczeń rzymska kg 
7859,13422,ozimek szynka z pieca kg 
7860,13424,sielawa wędzona kg 
7861,13425,bąkowski ciasto kostka piernikowa kg 
7862,13426,kozłowski szynka z wielichowa kg 
7863,13427,kozłowski kiełbaski z szynki kg 
7864,13428,kozłowski kiełbasa delikatesowa z piersi kurczaka kg 
7865,13429,roma kremówki firmowe szt 
7866,13430,ozimek karkówka z pieca kg 
7867,13431,ozimek ligawka z szynki kg 
7868,13432,masarnia krajenka kiełbasa polska pieczona kg 
7869,13433,masarnia krajenka kaszanka ciepła kg 
7870,13434,masarnia krajenka szynka wiejska ciepła kg 
7871,13435,mark s kiełbasa z bukowej wędzarni kg 
7872,13436,mark s golonka wlichnowska pieczona kg 
7873,13437,mark s kaszanka czarna kg 
7874,13438,mark s kiełbasa biała surowa z szynki kg 
7875,13439,frosta porcja kurczakowa z sosem serowym kg 
7876,13440,marciszyn galaretka drobiowa z warzywami g 
7877,13441,seko przysmak myśliwego z grzybami kg 
7878,13442,olek ciastko francuskie szt 
7879,13443,ser monouri kg 
7880,13444,monuri ser temar kg 
7881,13445,tomice krajanka piernikowa kg 
7882,13446,tomice strucel makowy kg 
7883,13447,tomice pierniczki kg 
7884,13450,różyccy kiełbasa klasztorna kg 
7885,13451,sokołów salceson z indykiem kg 
7886,13453,wędliny od zawsze szynka konserwowa prasowana kg 
7887,13454,wędliny od zawsze szynka szlachecka kg 
7888,13458,lewandowscy karkówka boryna kg 
7889,13459,fałkowo pierniki kg 
7890,13469,fałkowo jabłecznik kg 
7891,13470,fałkowo sernik królewski kg 
7892,13471,fałkowo piernik z praliną kg 
7893,13472,fałkowo tiramisu kg 
7894,13473,jagódka krajanka piernikowa g 
7895,13474,kilian trójkąty piernikowe kg 
7896,13475,kilian ciasteczka korzenne g 
7897,13476,gs nowe drożdżówka z rodzynkami szt 
7898,13477,orzechy nerkowca kg 
7899,13481,społem ciastka piernikowe kg 
7900,13482,roma kartofelki kg 
7901,13483,strzałkowo twaróg półtłusty mielony worek foliowy kg 
7902,13484,tomex pierniki ala katarzynki kg 
7903,13485,jagódka makówka kg 
7904,13486,sweetpol torcik piernikowy luz 
7905,13493,krośnice pierniki kg 
7906,13494,dorsz polędwica świeża kg 
7907,13495,roma choinki leżące szt 
7908,13496,roma gwiazdki szt 
7909,13497,roma bomby piernikowe kg 
7910,13498,roma markizy kg 
7911,13500,michowianka ser gouda kg 
7912,13501,michowianka ser ze stołu kg 
7913,13502,zębacz stek kg 
7914,13505,kilian kostka miodowa z cynamonem kg 
7915,13508,roladka z kurczaka z żurawiną i chrzanem kg 
7916,13509,rosette uszka z kapustą i pieczarkami kg 
7917,13510,perła śledzie z porem kg 
7918,13511,piekuś ciastka maślane kg 
7919,13512,ita piernik kg 
7920,13513,ita makowiec rulon kg 
7921,13516,łobza makowiec biały mak kg 
7922,13517,anna jabłecznik szt 
7923,13518,kozłowski parówki z szynki kg 
7924,13519,ita sernik z rodzynką kg 
7925,13520,fałkowo makowiec kg 
7926,13521,kozłowski szynka gotowana siatka kg 
7927,13524,bomax sernik szt 
7928,13525,chrupek makowiec g 
7929,13526,kilian piernik dekoracyjny szt 
7930,13527,krośnice strucla makowa g 
7931,13528,fiszer ozorki w galarecie szt 
7932,13529,fałkowo kostka gruszkowa kg 
7933,13530,fałkowo ciasto jabłecznik kg 
7934,13531,fałkowo ciasto hiszpanka kg 
7935,13532,fałkowo ciasto brownie z żurawiną kg 
7936,13533,fałkowo ciasto w z kg 
7937,13534,fałkowo ciato makowe z wiśnią kg 
7938,13535,fałkowo kostka piernikowa kg 
7939,13536,fałkowo ciasto piernikowe korzenne kg 
7940,13537,fałkowo kostka zebra kg 
7941,13538,olsza zestaw bożonarodzeniowy szt 
7942,13539,sweetpol francuski g 
7943,13540,papryka nadziewana serem kg 
7944,13541,mandarynki op 
7945,13543,ita ptasie z galaretką kg 
7946,13544,piekuś babeczka sylwestrowa szt 
7947,13545,piekuś tort sylwestrowy kinder g 
7948,13546,piekuś tort sylwestrowy cesarski g 
7949,13547,kilian tort sylwestrowy szt 
7950,13548,roma chruściki kg 
7951,13549,fałkowo rolada makow kg 
7952,13550,fałkowo rolada czekoladowa kg 
7953,13551,fałkowo kostka alpejska kg 
7954,13552,fałkowo malinowa chmurka kg 
7955,13555,ozimek kiełbasa bostońska kg 
7956,13556,tomice muszle karbowane kg 
7957,13557,zenard rogaliki kg 
7958,13558,zenard obwarzanka szt 
7959,13559,zenard ekler szt 
7960,13560,zenard ciastko p f szt 
7961,13561,rogalik chleb tostowy szt 
7962,13562,kacperek drożdżówka szt 
7963,13563,kacperek pączki z marmoladą szt 
7964,13564,kacperek pączki z serem szt 
7965,13565,kacperek pączki z adwokatem szt 
7966,13566,kacperek miodowiec kg 
7967,13567,kacperek rolada z bitą śmietaną kg 
7968,13568,kacperek wiśniowa rozkosz kg 
7969,13569,szypiórkowski chleb krojony szt 
7970,13570,szypiórkowski chleb razowy szt 
7971,13571,szypiórkowski chleb ig szt 
7972,13572,szypiórkowski chleb pasterski szt 
7973,13573,szypiórkowski chleb złoty orkisz szt 
7974,13574,szypiórkowski chleb żytni szt 
7975,13575,szypiórkowski bułka rozmaitości szt 
7976,13576,szypiórkowski bułka mała szt 
7977,13577,szypiórkowski bułka czwórka szt 
7978,13578,szypiórkowski rogal paluch bułka maśl szt 
7979,13580,mlekpol ser morski kg 
7980,13583,kacperek drożdżówka z jagodami szt 
7981,13584,kacperek gniazdka szt 
7982,13585,kacperek rożki francuskie z serem szt 
7983,13586,kacperek precelki szt 
7984,13587,kacperek strucla szt 
7985,13588,kacperek chałka maślana szt 
7986,13589,kacperek rogaliki kruche kg 
7987,13590,kacperek ciasteczka z wiśniami kg 
7988,13591,kacperek kulki serowe kg 
7989,13592,kacperek karbowane kg 
7990,13593,kacperek magda kg 
7991,13594,kacperek pychotka kg 
7992,13595,kacperek rajskie jabłko kg 
7993,13596,kacperek łabędzi puch kg 
7994,13597,kacperek śnieżynka kg 
7995,13598,kacperek sernik wiedeński kg 
7996,13599,kacperek sernik wiśnia kg 
7997,13600,kacperek sernik z brzoskwiniami kg 
7998,13601,kacperek seromak kg 
7999,13602,kacperek sernik nutella kg 
8000,13603,kacperek sernik z lukrem kg 
8001,13604,kacperek sernik z wanilią kg 
8002,13605,kacperek kruche z cukrem kg 
8003,13606,kacperek eklerki kg 
8004,13607,drobimex baton szynkowy z kurcząt kg 
8005,13610,kacperek rurka z bitą śmietaną szt 
8006,13611,kacperek rogaliki półfrancuskie kg 
8007,13612,kacperek ciastka z rodzynkami kg 
8008,13613,kacperek ekler szt 
8009,13616,olewnik schab wiśniowy kg 
8010,13617,monika chałka szt 
8011,13618,ozimek kiełbasa rawska kg 
8012,13620,tomice faworki kg 
8013,13621,prosiaczek boczek szefa kg 
8014,13622,kacperek placek drożdżowy foremka szt 
8015,13623,kacperek adwokatki kg 
8016,13624,kacperek cynamonki kg 
8017,13625,kacperek babka piaskowa kg 
8018,13626,kacperek babka kakaowa kg 
8019,13627,kacperek babka twarogowa kg 
8020,13628,kacperek cytrynowa kg 
8021,13629,kacperek babka pomarańczowa kg 
8022,13630,kacperek krówka kg 
8023,13632,kacperek gniazdka kg 
8024,13633,arturo boczek parzony kg 
8025,13634,arturo boczek wędzony kg 
8026,13635,kacperek ciastka kudłacze kg 
8027,13636,kacperek pączki z toffi szt 
8028,13637,kacperek pączki z budyniem szt 
8029,13638,kacperek pączki z makiem szt 
8030,13639,kacperek chałka z rodzynkami szt 
8031,13640,kacperek orzechowiec kg 
8032,13641,kacperek snikers kg 
8033,13642,kacperek tęcza kg 
8034,13643,kacperek babka cytrynowa kg 
8035,13644,kacperek sernik toffi kg 
8036,13646,szypiórkowski chleb razowy z dynią szt 
8037,13647,szypiórkowski chleb rustal szt 
8038,13648,szypiórkowski chleb wielozbożowy życia szt 
8039,13649,cf bagietka rustykalna szt 
8040,13650,kacperek kokosanki kg 
8041,13651,kacperek kostka piernik kg 
8042,13652,zenard ekler kg 
8043,13654,roma torcik tiramisu kg 
8044,13655,roma torcik truskawkowy kg 
8045,13656,monika stokrotka drożdżowa szt 
8046,13657,szypiórkowski ciabata szt 
8047,13659,kilian kostka pianka królewska kg 
8048,13660,kilian kostka rajskie rozdanie kg 
8049,13661,kilian faworek szt 
8050,13662,kilian tort mini szt 
8051,13663,kilian ekler owoc szt 
8052,13664,kilian bezoletka mini cm szt 
8053,13665,kacperek keks kg 
8054,13666,różyccy pasztet z żurawiną kg 
8055,13667,ita ciasto krówka kg 
8056,13669,rosette łazanka kg 
8057,13675,kilian pączek z marmoladą szt 
8058,13676,słodkie niebo ciasto kubuś kg 
8059,13677,kacperek beza kg 
8060,13678,wieczorek bułka kanapka szt 
8061,13679,wieczorek bułka z pieczarkami g 
8062,13680,sweetpol snickers g 
8063,13683,mar s rolada królewska kg 
8064,13684,mar s rolada wiśniowa kg 
8065,13685,mar s ptysiowa rozkosz kg 
8066,13686,mar s balladyna kg 
8067,13687,mar s murzynek z serem kg 
8068,13688,mar s brzoskwiniowo czekoladowe kg 
8069,13689,mar s rurki ze śmietaną i toffi kg 
8070,13690,cf ciastko wieloziar z ser i borówkami szt 
8071,13693,smoliński kiełbasa mortadela wegańska kg 
8072,13694,wędliny od zawsze golonka konserwowa kg 
8073,13696,swojscy mortadela delikatesowa kg 
8074,13697,swojscy pasztet z suszonymi pomidorami kg 
8075,13698,krośnice ciasto princessa z wisnia kg 
8076,13699,krośnice ciasto królewskie kg 
8077,13701,muszalscy chleb żytni 
8078,13703,muszalscy kanapka zbożowa szt 
8079,13710,muszalscy pizza mała szt 
8080,13713,madej wróbel szynka wójta kg 
8081,13714,swojscy parówkowa królewska kg 
8082,13715,vici krewetki maxi w oleju kg 
8083,13716,przecena spożywka nr 
8084,13717,mniaam mniaam kluski śląskie kg 
8085,13718,macioszek ciastka drożdzowe g 
8086,13726,słomiński polędwica sopocka kg 
8087,13727,słomiński kiełbasa biała parzona delikatesowa kg 
8088,13728,ozimek kiełbasa krakowska parzona kg 
8089,13731,hortex wiśnie kg 
8090,13732,kilian kostka bergamotka kg 
8091,13734,mar s rafaello kg 
8092,13737,olsza ciasto owocowe szt 
8093,13738,olek ciasto jogurtowe kg 
8094,13739,kacperek faworki kg 
8095,13740,tomex ciastka mix kg 
8096,13741,cf bułka swojska g 
8097,13746,kacperek rogaliki drożdżowe kg 
8098,13747,tomex trójkąty kg 
8099,13748,mlekovita ser gouda kg 
8100,13750,tosta bułka walentynka szt 
8101,13751,obórka smalec z kiełbasą g 
8102,13752,słodkie niebo ciasto cytrynka kg 
8103,13753,fałkowo chleb szczepan szt 
8104,13755,roma babeczki sernikowe szt 
8105,13756,roma mufinki szt 
8106,13757,roma serca mufiny szt 
8107,13758,tomice ptysie kg 
8108,13759,jagódka tort tiramisu kg 
8109,13760,fenicja smażone filety z serem kg 
8110,13761,roma serce marcepanowe szt 
8111,13762,ozimek polędwica mahoniowa kg 
8112,13763,olewnik pierś gotowana z indyka kg 
8113,13764,drobimex szynka drobiowa kg 
8114,13765,pychota sałatka chłopska g 
8115,13766,olsza ptyś z owocami g szt 
8116,13768,olsza babeczki serowe kg 
8117,13769,olsza półksiężyce mini z jabłkiem kg 
8118,13770,olsza bananowy song kg 
8119,13771,olsza biszkopt z truskawkami kg 
8120,13772,olsza czekoladowe trio kg 
8121,13773,olsza sernik straciatella z mango kg 
8122,13774,olsza słony karmel z orzechami kg 
8123,13775,olsza rolada z tiramisu domowa kg 
8124,13776,olsza rolada śmietankowa domowa kg 
8125,13777,olsza sernik krakowski domowy kg 
8126,13778,olsza ciasto piaskowe marmurek kg 
8127,13779,papryka podłużna kg 
8128,13780,ser hipokryta z orzechami włoskimi kg 
8129,13781,tosmak pączek tradycyjny szt 
8130,13782,tosmak pączek z ajerkoniakiem szt 
8131,13783,fałkowo chleb szczepana połówka 
8132,13786,mars ciasto śmietankowe oreo kg 
8133,13790,cf paluch fit g 
8134,13791,bąkowski drożdżówka z budyniem szt 
8135,13793,bąkowski ciastko francuskie szt 
8136,13794,kilian gniazdko szt 
8137,13797,ciepłuch smarowidełko szt 
8138,13801,olsza donut czekloadowy szt 
8139,13802,olsza pączusie malinowe kg 
8140,13803,olsza pączusie wiśniowe kg 
8141,13804,hert pączek szt 
8142,13805,różyccy pieczeń farmerska kg 
8143,13806,obórka smalec biały mały szt 
8144,13808,michowianka ser dublet netto kg 
8145,13810,kompot z czereśni ml 
8146,13812,olsza koperty z owocami kg 
8147,13813,olsza kostka chałwowa kg 
8148,13814,olsza izaura kg 
8149,13815,olsza sernik malucha kg 
8150,13816,olsza brownie karmelowo orzechowe kg 
8151,13817,olsza ciasto marchewkowe kg 
8152,13818,bystry kiełbasa biesiadna kg 
8153,13819,słodkie niebo ciasto fantazja kg 
8154,13821,ozimek pasztetowa drobiowa kg 
8155,13822,la lorraine pączek wieloowocowy szt 
8156,13823,lewandowscy smalec wyborowy g 
8157,13824,sokołów parówkowa firmowa kg 
8158,13845,pomidor śliwkowy żółty kg 
8159,13846,kemizo polędwica sopocka kg 
8160,13848,olsza hiszpańska pomarańcza kg 
8161,13849,olsza mascarpone z czerwoną porzeczką kg 
8162,13850,olsza raffaelo kg 
8163,13851,olsza sernik czekoladowy kg 
8164,13852,grobelski murzynek kg 
8165,13855,peklimar kiełbasa klasztorna kg 
8166,13857,cf przekąska z wędzoną papryką i serkiem szt 
8167,13858,marol karol budziszewski kiełbasa biała surowa kg 
8168,13861,bąkowski serduszko deserowe z galarteką szt 
8169,13862,bomax chleb domowy g 
8170,13863,różyccy polędwiczka klasztorna kg 
8171,13865,kokosanka sernik kwiatek szt 
8172,13867,kilian wisienki w cieście kg 
8173,13868,kilian tarta słony karmel szt 
8174,13869,emko jagodzianke szt 
8175,13870,sokołów salami w obsypce czosnkowej kg 
8176,13871,sokołów salami drobny pieprz gold kg 
8177,13872,mik mar amerykany g 
8178,13873,mik mar ekler g 
8179,13874,mik mar pączki g 
8180,13875,mik mar ptysie g 
8181,13876,mik mar babeczki z owocem szt 
8182,13877,mik mar bankietówki szt 
8183,13878,mik mar ciasto kg 
8184,13879,mik mar ozdoby szt 
8185,13880,mik mar tort na śmietanie kg 
8186,13881,gs wolsztyn chleb mazowiecki kg kroj 
8187,13882,gs wolsztyn chleb mazowiecki kg n kr 
8188,13883,gs wolsztyn chleb kornel kg kroj 
8189,13884,gs wolsztyn bułka wrocławska g 
8190,13885,gs wolsztyn bułka wrocławska g 
8191,13886,gs wolsztyn bułka grahamka g 
8192,13887,kargowa bułka mała g 
8193,13888,kargowa chleb baltonowski krojony szt 
8194,13890,słomiński pasztet z kaczki szt 
8195,13891,słomiński kiełbasa geesowska kg 
8196,13892,jbb klops mięsny kg 
8197,13893,kuchnia staropolska smalec z cebulka g 
8198,13894,paluszki mintaj kg 
8199,13896,olsza czarny las kg 
8200,13897,olsza pączusie z morelami kg 
8201,13898,olsza sernik za zimno kg 
8202,13899,olsza sernik z toffe czekoladą kg 
8203,13900,ciast ostrow deser z pianka luz 
8204,13901,ciast ostrow petitki czekol luz 
8205,13902,ciast ostrow petitki luz 
8206,13903,spód d tortów g 
8207,13904,ciastk bogutti rogaliki luz 
8208,13905,ciast ciach pol rurka wafel krem luz 
8209,13906,kuchnia staropol smalec z cebulka g 
8210,13909,luz cuk hildebrand zajaczki w czekoladzie kg 
8211,13957,zielński smalec kg 
8212,13966,mik mars spody tort luz 
8213,13967,mik mars spody bezowe luz 
8214,13970,luz ciast zator wafle z kremem luz 
8215,13980,ciast bergen słony krarmel kg 
8216,13981,ciastko deserowe kg 
8217,13984,luz ciast ciach pol wafle sadeckie luz 
8218,13986,luz ciast kamaj szarlotka luz 
8219,13988,luz ciast kamaj tixy luz 
8220,13999,luz ciastka piernik duo tago serce luz 
8221,14000,luz ciastka piernik ja piernicze luz 
8222,14036,zieliński smalec maly szt 
8223,14054,kacperek rogaliki poznańskie z makiem kg 
8224,14055,kacperek rogaliki z makiem świąteczne kg 
8225,14056,kuźniańska spiżarnia osełka z kużiniańskiej spiżarni kg 
8226,14057,kuźniańska spiżarnia kasler bez żebra z kuźniańskiej spiżarni kg 
8227,14058,kuźniańska spiżarnia kiełbasa staropolska z kuźniarskiej spiżarni kg 
8228,14059,kuźniańska spiżarnia kuźniczanka ze spiżarni kg 
8229,14061,opakowanie plastik koszyczek 
8230,14095,mro luz zupa jarzynowa kg 
8231,14097,baranek wielkanocny g 
8232,14098,sok o 
8233,14145,ogrod dymka g 
8234,14171,dz słonecznik czarny 
8235,14192,ryba mrożona tuszka kg 
8236,14194,ryby mrożone losoś kostka kg 
8237,14195,grenadier tuszka kg 
8238,14196,ryby mrożona paluszki z fileta kg 
8239,14197,mlekpol ser mozzarella kg 
8240,14226,łobza chleb żytni z ziarnami cały g 
8241,14227,lewandowscy pasztet ze szczypiorkiem kg 
8242,14235,lody ciepłe mix szt 
8243,14236,tomex ciastka markiza kg 
8244,14238,sendal poduszeczki serowe g 
8245,14239,tomex kostka kokosowa kg 
8246,14241,olsza ciasto makowiec babuni kg 
8247,14242,olsza kruche z bakaliami kg 
8248,14243,olsza kawowa chmurka kg 
8249,14244,olsza wiśniowy raj kg 
8250,14245,mat piek bułka alpejska szt 
8251,14246,mat piek bułka kukurydziana szt 
8252,14247,mat piek bułka orkiszowa szt 
8253,14248,mat piek bułka śniadaniowa szt 
8254,14249,mat piek bułka zawijana poznańska szt 
8255,14250,mat piek bułka pszenna g 
8256,14251,mat piek bułka inter szt 
8257,14252,mat piek wianek z makiem i serem szt 
8258,14253,mat piek drożdzówka z marmoladą szt 
8259,14254,mat piek pączki z powidłami szt 
8260,14255,mat piek pączek z adwokatem szt 
8261,14256,mat piek pączek szt 
8262,14257,mat piek paluch serowy szt 
8263,14258,mat piek omlet z nadzieniem szt 
8264,14259,mat piek drożdżówka z serem szt 
8265,14260,mat piek kule maślankowe kg 
8266,14261,mat piek faworki kg 
8267,14262,pmb konserwa wojskowa kg 
8268,14263,mielczarek kiełbaski piwoszki kg 
8269,14264,mielczarek pasztet wędzony z ogórkiem kg 
8270,14265,macioszek hamburger szt 
8271,14266,macioszek kebab szt 
8272,14267,łosoś szaszłyk n g kg 
8273,14270,gospodarstwo p łuc święzy sok z jabłek ml 
8274,14272,rosette placki ziemniaczane kg 
8275,14273,olek mini pączusie kg 
8276,14274,piekuś babeczka wiosenna szt 
8277,14275,bąkowski chleb swojski g 
8278,14276,mucha chleb 
8279,14277,łabiszyn chleb 
8280,14278,macioszek ciastka makiełki kg 
